VERSION 20070824
PCIDEV 0000 8086590f 0 0 0 0 0 0 0 0 0 0 0 0 0 0 0 skl_uncore
PCIDEV 0010 80865912 85 ee000004 0 d000000c 0 f001 0 c0002 1000000 0 10000000 0 40 0 20000 i915
PCIDEV 00a0 8086a2af 7c ef1b0004 0 0 0 0 0 0 10000 0 0 0 0 0 0 xhci_hcd
PCIDEV 00a2 8086a2b1 ff ef1d4004 0 0 0 0 0 0 1000 0 0 0 0 0 0 
PCIDEV 00a8 8086a2e0 10 ef1d3004 0 0 0 0 0 0 1000 0 0 0 0 0 0 intel-lpss
PCIDEV 00b0 8086a2ba 84 ef1d2004 0 0 0 0 0 0 1000 0 0 0 0 0 0 mei_me
PCIDEV 00b8 80862822 82 ef1c0000 ef1d1000 f091 f081 f061 ef100000 0 8000 100 8 4 20 80000 0 ahci
PCIDEV 00e0 8086a293 7a 0 0 0 0 0 0 0 0 0 0 0 0 0 0 pcieport
PCIDEV 00e6 8086a296 7b 0 0 0 0 0 0 0 0 0 0 0 0 0 0 pcieport
PCIDEV 00f8 8086a2c6 0 0 0 0 0 0 0 0 0 0 0 0 0 0 0 
PCIDEV 00fa 8086a2a1 0 ef1cc000 0 0 0 0 0 0 4000 0 0 0 0 0 0 
PCIDEV 00fb 8086a2f0 86 ef1c8004 0 0 0 ef1a0004 0 0 4000 0 0 0 10000 0 0 snd_hda_intel
PCIDEV 00fc 8086a2a3 17 ef1d0004 0 0 0 f041 0 0 100 0 0 0 20 0 0 i801_smbus
PCIDEV 00fe 808615e3 81 ef180000 0 0 0 0 0 0 20000 0 0 0 0 0 0 e1000e
PCIDEV 0100 104c8240 0 0 0 0 0 0 0 0 0 0 0 0 0 0 0 
PCIDEV 0300 10ec8125 12 e001 0 ef000004 0 ef010004 0 0 100 0 10000 0 4000 0 0 
R 1 550.106843 3 0xef000037 0xc 0x0 0
W 4 550.106856 3 0xef000014 0x0 0x0 0
R 1 550.106871 3 0xef000037 0xc 0x0 0
W 4 550.106872 3 0xef000010 0xffffe000 0x0 0
W 4 550.106874 3 0xef000010 0xffffe008 0x0 0
R 4 550.106894 3 0xef000010 0xffffe000 0x0 0
R 1 550.107738 3 0xef000037 0xc 0x0 0
W 4 550.107740 3 0xef000014 0x0 0x0 0
R 1 550.107755 3 0xef000037 0xc 0x0 0
W 4 550.107756 3 0xef000010 0xffffe000 0x0 0
W 4 550.107758 3 0xef000010 0xffffe008 0x0 0
R 4 550.107778 3 0xef000010 0xffffe000 0x0 0
R 1 550.107937 3 0xef000037 0xc 0x0 0
W 4 550.107939 3 0xef000014 0x0 0x0 0
R 1 550.107953 3 0xef000037 0xc 0x0 0
W 4 550.107955 3 0xef000010 0xffffe000 0x0 0
W 4 550.107956 3 0xef000010 0xffffe008 0x0 0
R 4 550.107976 3 0xef000010 0xffffe000 0x0 0
R 1 557.695660 3 0xef000037 0xc 0x0 0
W 4 557.695662 3 0xef000014 0x0 0x0 0
R 1 557.695677 3 0xef000037 0xc 0x0 0
W 4 557.695678 3 0xef000010 0xffffe000 0x0 0
W 4 557.695680 3 0xef000010 0xffffe008 0x0 0
R 4 557.695700 3 0xef000010 0xffffe000 0x0 0
R 1 557.695717 3 0xef000037 0xc 0x0 0
W 4 557.695719 3 0xef000014 0x0 0x0 0
R 1 557.695733 3 0xef000037 0xc 0x0 0
W 4 557.695740 3 0xef000010 0xffffe000 0x0 0
W 4 557.695742 3 0xef000010 0xffffe008 0x0 0
R 4 557.695761 3 0xef000010 0xffffe000 0x0 0
W 4 557.702265 3 0xef0000b8 0x52000000 0x0 0
R 4 557.702269 3 0xef0000b8 0xd2001040 0x0 0
R 4 557.702272 3 0xef0000b8 0xd2001040 0x0 0
W 4 557.702273 3 0xef0000b8 0xd2001840 0x0 0
R 4 557.702276 3 0xef0000b8 0x52001840 0x0 0
R 1 557.702285 3 0xef000037 0xc 0x0 0
W 4 557.702286 3 0xef000014 0x0 0x0 0
R 1 557.702299 3 0xef000037 0xc 0x0 0
W 4 557.702301 3 0xef000010 0xffffe000 0x0 0
W 4 557.702303 3 0xef000010 0xffffe008 0x0 0
R 4 557.702322 3 0xef000010 0xffffe000 0x0 0
R 1 557.702334 3 0xef000037 0xc 0x0 0
W 4 557.702340 3 0xef000038 0x0 0x0 0
W 4 557.702342 3 0xef00003c 0xffffffff 0x0 0
R 1 557.702351 3 0xef000037 0xc 0x0 0
R 4 557.702359 3 0xef000044 0x40c20f0e 0x0 0
W 4 557.702361 3 0xef000044 0x40c20f00 0x0 0
R 4 557.702384 3 0xef0000f0 0x3f 0x0 0
W 4 557.702386 3 0xef0000f0 0x8003f 0x0 0
R 1 557.706622 3 0xef000037 0xc 0x0 0
W 1 557.706625 3 0xef000037 0x8c 0x0 0
R 1 557.706653 3 0xef0000d3 0x32 0x0 0
R 2 557.706663 3 0xef0000e2 0x103 0x0 0
W 1 557.710922 3 0xef000037 0x10 0x0 0
R 1 557.710940 3 0xef000037 0x0 0x0 0
W 4 557.710942 3 0xef0000b0 0x60560000 0x0 0
R 4 557.710956 3 0xef0000b0 0x1f82 0x0 0
W 4 557.710958 3 0xef0000b0 0xe0560002 0x0 0
W 4 557.711307 4 0xef01000c 0x1 0x0 0
R 4 557.711323 4 0xef010000 0xfee00438 0x0 0
W 4 557.711327 4 0xef010000 0x0 0x0 0
W 4 557.711329 4 0xef010004 0x0 0x0 0
W 4 557.711330 4 0xef010008 0x0 0x0 0
R 4 557.711360 4 0xef010008 0x0 0x0 0
R 1 557.711392 3 0xef000037 0x0 0x0 0
R 1 557.711683 3 0xef000037 0x0 0x0 0
W 1 557.714777 3 0xef000050 0xc0 0x0 0
W 4 557.714780 3 0xef000004 0xf397 0x0 0
R 1 557.714804 3 0xef000037 0x0 0x0 0
W 4 557.714806 3 0xef000000 0x3be78360 0x0 0
R 1 557.714824 3 0xef000037 0x0 0x0 0
W 1 557.714826 3 0xef000050 0x0 0x0 0
W 4 557.714941 4 0xef01000c 0x1 0x0 0
R 4 557.714957 4 0xef010000 0x0 0x0 0
UNMAP 557.714987 4 0x0 0
UNMAP 557.716800 3 0x0 0
MAP 592.086820 5 0xef000000 0xffffb47c810a0000 0x10000 0x0 0
R 4 592.086846 5 0xef000040 0x67100f00 0x0 0
W 4 592.086848 5 0xef0000b0 0x60590000 0x0 0
R 4 592.086872 5 0xef0000b0 0x67100000 0x0 0
R 2 592.086888 5 0xef0000e0 0x2020 0x0 0
W 4 592.086889 5 0xef000044 0x40000f00 0x0 0
W 4 592.086891 5 0xef000038 0x0 0x0 0
W 4 592.086892 5 0xef00003c 0xffffffff 0x0 0
R 1 592.086908 5 0xef000037 0x0 0x0 0
R 4 592.086918 5 0xef0000f0 0x8003f 0x0 0
W 4 592.086919 5 0xef0000f0 0x8003f 0x0 0
R 1 592.090363 5 0xef000037 0x0 0x0 0
W 1 592.090368 5 0xef000037 0x80 0x0 0
R 1 592.090387 5 0xef0000d3 0x32 0x0 0
R 2 592.090397 5 0xef0000e2 0x103 0x0 0
R 1 592.090407 5 0xef000037 0xc0 0x0 0
W 1 592.090409 5 0xef000037 0xc0 0x0 0
R 1 592.093366 5 0xef0000d3 0x32 0x0 0
W 1 592.093371 5 0xef0000d3 0x32 0x0 0
W 4 592.093372 5 0xef0000b0 0x746f0000 0x0 0
R 4 592.093396 5 0xef0000b0 0x32000000 0x0 0
W 4 592.093398 5 0xef0000b0 0xf46f0000 0x0 0
R 1 592.093414 5 0xef0000d3 0x32 0x0 0
W 4 592.093416 5 0xef0000b0 0xe05507d0 0x0 0
W 4 592.093417 5 0xef0000b0 0xe0530150 0x0 0
W 4 592.093419 5 0xef0000b0 0xe00f5555 0x0 0
R 1 592.093449 5 0xef0000d3 0x32 0x0 0
W 1 592.093450 5 0xef000037 0x10 0x0 0
R 1 592.093469 5 0xef000037 0x0 0x0 0
MAP 592.093500 6 0xef010000 0xffffb47c800bb000 0x200 0x0 0
W 4 592.093507 6 0xef01000c 0x1 0x0 0
W 4 592.093508 6 0xef01001c 0x1 0x0 0
W 4 592.093510 6 0xef01002c 0x1 0x0 0
W 4 592.093512 6 0xef01003c 0x1 0x0 0
W 4 592.093513 6 0xef01004c 0x1 0x0 0
W 4 592.093515 6 0xef01005c 0x1 0x0 0
W 4 592.093516 6 0xef01006c 0x1 0x0 0
W 4 592.093518 6 0xef01007c 0x1 0x0 0
W 4 592.093519 6 0xef01008c 0x1 0x0 0
W 4 592.093521 6 0xef01009c 0x1 0x0 0
W 4 592.093522 6 0xef0100ac 0x1 0x0 0
W 4 592.093524 6 0xef0100bc 0x1 0x0 0
W 4 592.093525 6 0xef0100cc 0x1 0x0 0
W 4 592.093527 6 0xef0100dc 0x1 0x0 0
W 4 592.093528 6 0xef0100ec 0x1 0x0 0
W 4 592.093530 6 0xef0100fc 0x1 0x0 0
W 4 592.093532 6 0xef01010c 0x1 0x0 0
W 4 592.093533 6 0xef01011c 0x1 0x0 0
W 4 592.093535 6 0xef01012c 0x1 0x0 0
W 4 592.093536 6 0xef01013c 0x1 0x0 0
W 4 592.093538 6 0xef01014c 0x1 0x0 0
W 4 592.093539 6 0xef01015c 0x1 0x0 0
W 4 592.093541 6 0xef01016c 0x1 0x0 0
W 4 592.093543 6 0xef01017c 0x1 0x0 0
W 4 592.093544 6 0xef01018c 0x1 0x0 0
W 4 592.093546 6 0xef01019c 0x1 0x0 0
W 4 592.093547 6 0xef0101ac 0x1 0x0 0
W 4 592.093549 6 0xef0101bc 0x1 0x0 0
W 4 592.093551 6 0xef0101cc 0x1 0x0 0
W 4 592.093552 6 0xef0101dc 0x1 0x0 0
W 4 592.093554 6 0xef0101ec 0x1 0x0 0
W 4 592.093555 6 0xef0101fc 0x1 0x0 0
R 4 592.093785 6 0xef01000c 0x1 0x0 0
W 4 592.093806 6 0xef010000 0xfee00438 0x0 0
W 4 592.093808 6 0xef010004 0x0 0x0 0
W 4 592.093809 6 0xef010008 0x0 0x0 0
R 4 592.093839 6 0xef010008 0x0 0x0 0
R 1 592.093858 5 0xef0019e0 0x60 0x0 0
R 1 592.093867 5 0xef0019e1 0x83 0x0 0
R 1 592.093876 5 0xef0019e2 0xe7 0x0 0
R 1 592.093886 5 0xef0019e3 0x3b 0x0 0
R 1 592.093895 5 0xef0019e4 0x97 0x0 0
R 1 592.093904 5 0xef0019e5 0xf3 0x0 0
W 1 592.093906 5 0xef000050 0xc0 0x0 0
W 4 592.093908 5 0xef000004 0xf397 0x0 0
R 1 592.093934 5 0xef000037 0x0 0x0 0
W 4 592.093936 5 0xef000000 0x3be78360 0x0 0
R 1 592.093955 5 0xef000037 0x0 0x0 0
W 1 592.093956 5 0xef000050 0x0 0x0 0
R 4 592.093975 5 0xef000044 0x40020f00 0x0 0
W 4 592.093976 5 0xef000044 0x40c20f00 0x0 0
W 2 592.093978 5 0xef0000e0 0x2020 0x0 0
R 1 592.094005 5 0xef000037 0x0 0x0 0
R 1 592.094007 5 0xef00006f 0x30 0x0 0
W 1 592.094009 5 0xef00006f 0x30 0x0 0
W 4 592.094084 5 0xef0000b8 0x52020000 0x0 0
R 4 592.094086 5 0xef0000b8 0xd202001c 0x0 0
R 4 592.094089 5 0xef0000b8 0xd202001c 0x0 0
W 4 592.094091 5 0xef0000b8 0x52030000 0x0 0
R 4 592.094094 5 0xef0000b8 0xd203c840 0x0 0
R 4 592.094096 5 0xef0000b8 0xd203c840 0x0 0
W 4 592.096392 5 0xef0000b8 0x530b0000 0x0 0
R 4 592.096398 5 0xef0000b8 0xd30b2070 0x0 0
R 4 592.096401 5 0xef0000b8 0xd30b2070 0x0 0
W 4 592.096403 5 0xef0000b8 0x52010000 0x0 0
R 4 592.096406 5 0xef0000b8 0xd2017989 0x0 0
R 4 592.096408 5 0xef0000b8 0xd2017989 0x0 0
W 4 592.096410 5 0xef0000b8 0x520f0000 0x0 0
R 4 592.096413 5 0xef0000b8 0xd20f2000 0x0 0
R 4 592.096416 5 0xef0000b8 0xd20f2000 0x0 0
W 4 592.096418 5 0xef0000b8 0x52e20000 0x0 0
R 4 592.096420 5 0xef0000b8 0xd2e20006 0x0 0
R 4 592.096423 5 0xef0000b8 0xd2e20006 0x0 0
W 4 592.096425 5 0xef0000b8 0x52e80000 0x0 0
R 4 592.096428 5 0xef0000b8 0xd2e80006 0x0 0
R 4 592.096431 5 0xef0000b8 0xd2e80006 0x0 0
W 4 592.096563 5 0xef0000b8 0x52000000 0x0 0
R 4 592.096568 5 0xef0000b8 0xd2001840 0x0 0
R 4 592.096571 5 0xef0000b8 0xd2001840 0x0 0
R 4 592.096641 5 0xef000044 0x40c20f00 0x0 0
W 4 592.096643 5 0xef000044 0x40c20f00 0x0 0
W 2 592.096645 5 0xef0000e0 0x2020 0x0 0
R 1 592.096671 5 0xef000037 0x0 0x0 0
R 1 592.096744 5 0xef000037 0x0 0x0 0
R 1 592.127943 5 0xef000037 0x0 0x0 0
R 1 592.128166 5 0xef000037 0x0 0x0 0
R 1 592.129440 5 0xef000037 0x0 0x0 0
R 1 592.137896 5 0xef000037 0x0 0x0 0
W 4 592.141643 6 0xef010000 0xfee00438 0x0 0
W 4 592.141646 6 0xef010004 0x0 0x0 0
W 4 592.141648 6 0xef010008 0x0 0x0 0
R 4 592.141674 6 0xef010008 0x0 0x0 0
W 4 592.141677 6 0xef01000c 0x0 0x0 0
W 4 592.141874 5 0xef0000b8 0x52000000 0x0 0
R 4 592.141879 5 0xef0000b8 0xd2001840 0x0 0
R 4 592.141882 5 0xef0000b8 0xd2001840 0x0 0
W 4 592.141884 5 0xef0000b8 0xd2001040 0x0 0
R 4 592.141887 5 0xef0000b8 0x52001040 0x0 0
W 4 592.163618 5 0xef0000b8 0x52000000 0x0 0
R 4 592.163632 5 0xef0000b8 0xd2001040 0x0 0
R 4 592.163634 5 0xef0000b8 0xd2001040 0x0 0
W 4 592.185591 5 0xef0000b0 0xfe240000 0x0 0
W 4 592.185599 5 0xef0000b0 0xfe140000 0x0 0
W 4 592.185601 5 0xef0000b0 0xfe150000 0x0 0
W 4 592.185603 5 0xef0000b0 0xfe160000 0x0 0
W 4 592.185605 5 0xef0000b0 0xfe170000 0x0 0
W 4 592.185607 5 0xef0000b0 0xfe180000 0x0 0
W 4 592.185608 5 0xef0000b0 0xfe190000 0x0 0
W 4 592.185610 5 0xef0000b0 0xfe1a0000 0x0 0
W 4 592.185612 5 0xef0000b0 0xfe1b0000 0x0 0
W 4 592.185614 5 0xef0000b0 0xfe1c0000 0x0 0
W 4 592.185616 5 0xef0000b0 0xfe1d0000 0x0 0
W 4 592.185618 5 0xef0000b0 0xfe1e0000 0x0 0
W 4 592.185619 5 0xef0000b0 0xfe1f0000 0x0 0
W 4 592.185621 5 0xef0000b0 0xfe200000 0x0 0
W 4 592.185623 5 0xef0000b0 0xfe210000 0x0 0
W 4 592.185625 5 0xef0000b0 0xfe220000 0x0 0
W 4 592.185627 5 0xef0000b0 0xfe230000 0x0 0
W 4 592.190578 5 0xef0000b0 0xfe130000 0x0 0
W 4 592.190587 5 0xef0000b0 0xfc00e008 0x0 0
W 4 592.190590 5 0xef0000b0 0xfc01e013 0x0 0
W 4 592.190592 5 0xef0000b0 0xfc02e01e 0x0 0
W 4 592.190594 5 0xef0000b0 0xfc03e02f 0x0 0
W 4 592.190596 5 0xef0000b0 0xfc04e035 0x0 0
W 4 592.190598 5 0xef0000b0 0xfc05e04f 0x0 0
W 4 592.190600 5 0xef0000b0 0xfc06e053 0x0 0
W 4 592.190602 5 0xef0000b0 0xfc07e055 0x0 0
W 4 592.190604 5 0xef0000b0 0xfc08740a 0x0 0
W 4 592.190606 5 0xef0000b0 0xfc094846 0x0 0
W 4 592.190608 5 0xef0000b0 0xfc0a4847 0x0 0
W 4 592.190610 5 0xef0000b0 0xfc0b9c0a 0x0 0
W 4 592.190612 5 0xef0000b0 0xfc0cc607 0x0 0
W 4 592.190614 5 0xef0000b0 0xfc0d74c0 0x0 0
W 4 592.190616 5 0xef0000b0 0xfc0e48c6 0x0 0
W 4 592.190618 5 0xef0000b0 0xfc0f9cc0 0x0 0
W 4 592.190620 5 0xef0000b0 0xfc10c602 0x0 0
W 4 592.190622 5 0xef0000b0 0xfc11be00 0x0 0
W 4 592.190624 5 0xef0000b0 0xfc1213f0 0x0 0
W 4 592.190627 5 0xef0000b0 0xfc13e054 0x0 0
W 4 592.190629 5 0xef0000b0 0xfc1472ca 0x0 0
W 4 592.190631 5 0xef0000b0 0xfc154826 0x0 0
W 4 592.190633 5 0xef0000b0 0xfc164827 0x0 0
W 4 592.190635 5 0xef0000b0 0xfc179aca 0x0 0
W 4 592.190637 5 0xef0000b0 0xfc18c607 0x0 0
W 4 592.190639 5 0xef0000b0 0xfc1972c0 0x0 0
W 4 592.190641 5 0xef0000b0 0xfc1a48a6 0x0 0
W 4 592.190643 5 0xef0000b0 0xfc1b9ac0 0x0 0
W 4 592.190645 5 0xef0000b0 0xfc1cc602 0x0 0
W 4 592.190647 5 0xef0000b0 0xfc1dbe00 0x0 0
W 4 592.190649 5 0xef0000b0 0xfc1e081c 0x0 0
W 4 592.190651 5 0xef0000b0 0xfc1fe054 0x0 0
W 4 592.190653 5 0xef0000b0 0xfc20c60f 0x0 0
W 4 592.190655 5 0xef0000b0 0xfc2174c4 0x0 0
W 4 592.190657 5 0xef0000b0 0xfc2249cc 0x0 0
W 4 592.190659 5 0xef0000b0 0xfc23f109 0x0 0
W 4 592.190661 5 0xef0000b0 0xfc24c60c 0x0 0
W 4 592.190663 5 0xef0000b0 0xfc2574ca 0x0 0
W 4 592.190665 5 0xef0000b0 0xfc2648c7 0x0 0
W 4 592.190667 5 0xef0000b0 0xfc279cca 0x0 0
W 4 592.190669 5 0xef0000b0 0xfc28c609 0x0 0
W 4 592.190671 5 0xef0000b0 0xfc2974c0 0x0 0
W 4 592.190673 5 0xef0000b0 0xfc2a4846 0x0 0
W 4 592.190675 5 0xef0000b0 0xfc2b9cc0 0x0 0
W 4 592.190677 5 0xef0000b0 0xfc2cc602 0x0 0
W 4 592.190679 5 0xef0000b0 0xfc2dbe00 0x0 0
W 4 592.190681 5 0xef0000b0 0xfc2e2494 0x0 0
W 4 592.190683 5 0xef0000b0 0xfc2fe092 0x0 0
W 4 592.190685 5 0xef0000b0 0xfc30e0c0 0x0 0
W 4 592.190687 5 0xef0000b0 0xfc31e054 0x0 0
W 4 592.190689 5 0xef0000b0 0xfc327420 0x0 0
W 4 592.190691 5 0xef0000b0 0xfc3348c0 0x0 0
W 4 592.190693 5 0xef0000b0 0xfc349c20 0x0 0
W 4 592.190695 5 0xef0000b0 0xfc357444 0x0 0
W 4 592.190697 5 0xef0000b0 0xfc36c602 0x0 0
W 4 592.190700 5 0xef0000b0 0xfc37be00 0x0 0
W 4 592.190702 5 0xef0000b0 0xfc3812dc 0x0 0
W 4 592.190704 5 0xef0000b0 0xfc39733a 0x0 0
W 4 592.190706 5 0xef0000b0 0xfc3a21b5 0x0 0
W 4 592.190708 5 0xef0000b0 0xfc3b25bc 0x0 0
W 4 592.190710 5 0xef0000b0 0xfc3c1304 0x0 0
W 4 592.190712 5 0xef0000b0 0xfc3df111 0x0 0
W 4 592.190714 5 0xef0000b0 0xfc3e1b12 0x0 0
W 4 592.190716 5 0xef0000b0 0xfc3f1d2a 0x0 0
W 4 592.190718 5 0xef0000b0 0xfc403168 0x0 0
W 4 592.190720 5 0xef0000b0 0xfc413ada 0x0 0
W 4 592.190722 5 0xef0000b0 0xfc4231ab 0x0 0
W 4 592.190724 5 0xef0000b0 0xfc431a00 0x0 0
W 4 592.190726 5 0xef0000b0 0xfc449ac0 0x0 0
W 4 592.190728 5 0xef0000b0 0xfc451300 0x0 0
W 4 592.190730 5 0xef0000b0 0xfc46f1fb 0x0 0
W 4 592.190732 5 0xef0000b0 0xfc477620 0x0 0
W 4 592.190734 5 0xef0000b0 0xfc48236e 0x0 0
W 4 592.190736 5 0xef0000b0 0xfc49276f 0x0 0
W 4 592.190738 5 0xef0000b0 0xfc4a1a3c 0x0 0
W 4 592.190740 5 0xef0000b0 0xfc4b22a1 0x0 0
W 4 592.190742 5 0xef0000b0 0xfc4c41b5 0x0 0
W 4 592.190744 5 0xef0000b0 0xfc4d9ee2 0x0 0
W 4 592.190746 5 0xef0000b0 0xfc4e76e4 0x0 0
W 4 592.190748 5 0xef0000b0 0xfc4f486f 0x0 0
W 4 592.190750 5 0xef0000b0 0xfc509ee4 0x0 0
W 4 592.190752 5 0xef0000b0 0xfc51c602 0x0 0
W 4 592.190754 5 0xef0000b0 0xfc52be00 0x0 0
W 4 592.190756 5 0xef0000b0 0xfc534a26 0x0 0
W 4 592.190758 5 0xef0000b0 0xfc54733a 0x0 0
W 4 592.190760 5 0xef0000b0 0xfc5549bb 0x0 0
W 4 592.190762 5 0xef0000b0 0xfc56c602 0x0 0
W 4 592.190764 5 0xef0000b0 0xfc57be00 0x0 0
W 4 592.190766 5 0xef0000b0 0xfc5847a2 0x0 0
W 4 592.190768 5 0xef0000b0 0xfc59c602 0x0 0
W 4 592.190770 5 0xef0000b0 0xfc5abe00 0x0 0
W 4 592.190773 5 0xef0000b0 0xfc5b0000 0x0 0
W 4 592.190775 5 0xef0000b0 0xfc5cc602 0x0 0
W 4 592.190777 5 0xef0000b0 0xfc5dbe00 0x0 0
W 4 592.190779 5 0xef0000b0 0xfc5e0000 0x0 0
W 4 592.190781 5 0xef0000b0 0xfe138000 0x0 0
W 4 592.190783 5 0xef0000b0 0xfe1413e6 0x0 0
W 4 592.190785 5 0xef0000b0 0xfe150812 0x0 0
W 4 592.190787 5 0xef0000b0 0xfe16248c 0x0 0
W 4 592.190789 5 0xef0000b0 0xfe1712da 0x0 0
W 4 592.190791 5 0xef0000b0 0xfe184a20 0x0 0
W 4 592.190793 5 0xef0000b0 0xfe1947a0 0x0 0
W 4 592.190795 5 0xef0000b0 0xfe24003f 0x0 0
W 4 592.190798 5 0xef0000b8 0x5c100000 0x0 0
R 4 592.191127 5 0xef0000b8 0xdc100000 0x0 0
R 4 592.191130 5 0xef0000b8 0xdc100000 0x0 0
W 4 592.191132 5 0xef0000b8 0xdc100010 0x0 0
R 4 592.191136 5 0xef0000b8 0x5c100010 0x0 0
W 4 592.193556 5 0xef0000b8 0x5c000000 0x0 0
R 4 592.193567 5 0xef0000b8 0xdc0000c0 0x0 0
R 4 592.193571 5 0xef0000b8 0xdc0000c0 0x0 0
W 4 592.193573 5 0xef0000b8 0xd21b8024 0x0 0
R 4 592.193577 5 0xef0000b8 0x521b8024 0x0 0
W 4 592.193579 5 0xef0000b8 0xd21c3701 0x0 0
R 4 592.193583 5 0xef0000b8 0x521c3701 0x0 0
W 4 592.193585 5 0xef0000b8 0xd21bb82e 0x0 0
R 4 592.193588 5 0xef0000b8 0x521bb82e 0x0 0
W 4 592.193591 5 0xef0000b8 0xd21c0001 0x0 0
R 4 592.193594 5 0xef0000b8 0x521c0001 0x0 0
W 4 592.193596 5 0xef0000b8 0xdc100090 0x0 0
R 4 592.193600 5 0xef0000b8 0x5c100090 0x0 0
W 4 592.193602 5 0xef0000b8 0xd21ba016 0x0 0
R 4 592.193606 5 0xef0000b8 0x521ba016 0x0 0
W 4 592.193608 5 0xef0000b8 0xd21c0000 0x0 0
R 4 592.193611 5 0xef0000b8 0x521c0000 0x0 0
W 4 592.193614 5 0xef0000b8 0xd21ba012 0x0 0
R 4 592.193617 5 0xef0000b8 0x521ba012 0x0 0
W 4 592.193620 5 0xef0000b8 0xd21c0000 0x0 0
R 4 592.193623 5 0xef0000b8 0x521c0000 0x0 0
W 4 592.193625 5 0xef0000b8 0xd21ba014 0x0 0
R 4 592.193629 5 0xef0000b8 0x521ba014 0x0 0
W 4 592.193631 5 0xef0000b8 0xd21c1800 0x0 0
R 4 592.193635 5 0xef0000b8 0x521c1800 0x0 0
W 4 592.193637 5 0xef0000b8 0xd21c8010 0x0 0
R 4 592.193640 5 0xef0000b8 0x521c8010 0x0 0
W 4 592.193643 5 0xef0000b8 0xd21c1800 0x0 0
R 4 592.193646 5 0xef0000b8 0x521c1800 0x0 0
W 4 592.193648 5 0xef0000b8 0xd21c801a 0x0 0
R 4 592.193652 5 0xef0000b8 0x521c801a 0x0 0
W 4 592.193654 5 0xef0000b8 0xd21c1800 0x0 0
R 4 592.193658 5 0xef0000b8 0x521c1800 0x0 0
W 4 592.193660 5 0xef0000b8 0xd21c8024 0x0 0
R 4 592.193663 5 0xef0000b8 0x521c8024 0x0 0
W 4 592.193666 5 0xef0000b8 0xd21c1800 0x0 0
R 4 592.193669 5 0xef0000b8 0x521c1800 0x0 0
W 4 592.193671 5 0xef0000b8 0xd21c802f 0x0 0
R 4 592.193675 5 0xef0000b8 0x521c802f 0x0 0
W 4 592.193677 5 0xef0000b8 0xd21c1800 0x0 0
R 4 592.193681 5 0xef0000b8 0x521c1800 0x0 0
W 4 592.193683 5 0xef0000b8 0xd21c8051 0x0 0
R 4 592.193686 5 0xef0000b8 0x521c8051 0x0 0
W 4 592.193689 5 0xef0000b8 0xd21c1800 0x0 0
R 4 592.193692 5 0xef0000b8 0x521c1800 0x0 0
W 4 592.193694 5 0xef0000b8 0xd21c8057 0x0 0
R 4 592.193698 5 0xef0000b8 0x521c8057 0x0 0
W 4 592.193700 5 0xef0000b8 0xd21c1800 0x0 0
R 4 592.193704 5 0xef0000b8 0x521c1800 0x0 0
W 4 592.193706 5 0xef0000b8 0xd21c8063 0x0 0
R 4 592.193709 5 0xef0000b8 0x521c8063 0x0 0
W 4 592.193712 5 0xef0000b8 0xd21c1800 0x0 0
R 4 592.193715 5 0xef0000b8 0x521c1800 0x0 0
W 4 592.193718 5 0xef0000b8 0xd21c8068 0x0 0
R 4 592.193721 5 0xef0000b8 0x521c8068 0x0 0
W 4 592.193723 5 0xef0000b8 0xd21cd093 0x0 0
R 4 592.193727 5 0xef0000b8 0x521cd093 0x0 0
W 4 592.193729 5 0xef0000b8 0xd21cd1c4 0x0 0
R 4 592.193732 5 0xef0000b8 0x521cd1c4 0x0 0
W 4 592.193735 5 0xef0000b8 0xd21c1000 0x0 0
R 4 592.193738 5 0xef0000b8 0x521c1000 0x0 0
W 4 592.193741 5 0xef0000b8 0xd21c135c 0x0 0
R 4 592.193744 5 0xef0000b8 0x521c135c 0x0 0
W 4 592.193746 5 0xef0000b8 0xd21cd704 0x0 0
R 4 592.193750 5 0xef0000b8 0x521cd704 0x0 0
W 4 592.193752 5 0xef0000b8 0xd21c5fbc 0x0 0
R 4 592.193755 5 0xef0000b8 0x521c5fbc 0x0 0
W 4 592.193758 5 0xef0000b8 0xd21cd504 0x0 0
R 4 592.193761 5 0xef0000b8 0x521cd504 0x0 0
W 4 592.193763 5 0xef0000b8 0xd21cc9f1 0x0 0
R 4 592.193767 5 0xef0000b8 0x521cc9f1 0x0 0
W 4 592.193769 5 0xef0000b8 0xd21c1800 0x0 0
R 4 592.193773 5 0xef0000b8 0x521c1800 0x0 0
W 4 592.193775 5 0xef0000b8 0xd21c0fc9 0x0 0
R 4 592.193778 5 0xef0000b8 0x521c0fc9 0x0 0
W 4 592.193781 5 0xef0000b8 0xd21cbb50 0x0 0
R 4 592.193784 5 0xef0000b8 0x521cbb50 0x0 0
W 4 592.193787 5 0xef0000b8 0xd21cd505 0x0 0
R 4 592.193791 5 0xef0000b8 0x521cd505 0x0 0
W 4 592.193793 5 0xef0000b8 0xd21ca202 0x0 0
R 4 592.193797 5 0xef0000b8 0x521ca202 0x0 0
W 4 592.193799 5 0xef0000b8 0xd21cd504 0x0 0
R 4 592.193802 5 0xef0000b8 0x521cd504 0x0 0
W 4 592.193805 5 0xef0000b8 0xd21c8c0f 0x0 0
R 4 592.193808 5 0xef0000b8 0x521c8c0f 0x0 0
W 4 592.193810 5 0xef0000b8 0xd21cd500 0x0 0
R 4 592.193814 5 0xef0000b8 0x521cd500 0x0 0
W 4 592.193816 5 0xef0000b8 0xd21c1000 0x0 0
R 4 592.193820 5 0xef0000b8 0x521c1000 0x0 0
W 4 592.193822 5 0xef0000b8 0xd21c1519 0x0 0
R 4 592.193825 5 0xef0000b8 0x521c1519 0x0 0
W 4 592.193828 5 0xef0000b8 0xd21c1800 0x0 0
R 4 592.193831 5 0xef0000b8 0x521c1800 0x0 0
W 4 592.193833 5 0xef0000b8 0xd21c1548 0x0 0
R 4 592.193837 5 0xef0000b8 0x521c1548 0x0 0
W 4 592.193839 5 0xef0000b8 0xd21c2f70 0x0 0
R 4 592.193843 5 0xef0000b8 0x521c2f70 0x0 0
W 4 592.193845 5 0xef0000b8 0xd21c802a 0x0 0
R 4 592.193848 5 0xef0000b8 0x521c802a 0x0 0
W 4 592.193851 5 0xef0000b8 0xd21c2f73 0x0 0
R 4 592.193854 5 0xef0000b8 0x521c2f73 0x0 0
W 4 592.193856 5 0xef0000b8 0xd21c156a 0x0 0
R 4 592.193860 5 0xef0000b8 0x521c156a 0x0 0
W 4 592.193862 5 0xef0000b8 0xd21c1800 0x0 0
R 4 592.193866 5 0xef0000b8 0x521c1800 0x0 0
W 4 592.193868 5 0xef0000b8 0xd21c155c 0x0 0
R 4 592.193871 5 0xef0000b8 0x521c155c 0x0 0
W 4 592.193874 5 0xef0000b8 0xd21cd505 0x0 0
R 4 592.193877 5 0xef0000b8 0x521cd505 0x0 0
W 4 592.193879 5 0xef0000b8 0xd21ca202 0x0 0
R 4 592.193883 5 0xef0000b8 0x521ca202 0x0 0
W 4 592.193885 5 0xef0000b8 0xd21cd500 0x0 0
R 4 592.193889 5 0xef0000b8 0x521cd500 0x0 0
W 4 592.193891 5 0xef0000b8 0xd21c1800 0x0 0
R 4 592.193894 5 0xef0000b8 0x521c1800 0x0 0
W 4 592.193897 5 0xef0000b8 0xd21c1551 0x0 0
R 4 592.193900 5 0xef0000b8 0x521c1551 0x0 0
W 4 592.193902 5 0xef0000b8 0xd21cc0c1 0x0 0
R 4 592.193906 5 0xef0000b8 0x521cc0c1 0x0 0
W 4 592.193908 5 0xef0000b8 0xd21cc0c0 0x0 0
R 4 592.193912 5 0xef0000b8 0x521cc0c0 0x0 0
W 4 592.193914 5 0xef0000b8 0xd21cd05a 0x0 0
R 4 592.193917 5 0xef0000b8 0x521cd05a 0x0 0
W 4 592.193920 5 0xef0000b8 0xd21cd1ba 0x0 0
R 4 592.193923 5 0xef0000b8 0x521cd1ba 0x0 0
W 4 592.193925 5 0xef0000b8 0xd21cd701 0x0 0
R 4 592.193929 5 0xef0000b8 0x521cd701 0x0 0
W 4 592.193931 5 0xef0000b8 0xd21c2529 0x0 0
R 4 592.193935 5 0xef0000b8 0x521c2529 0x0 0
W 4 592.193937 5 0xef0000b8 0xd21c022a 0x0 0
R 4 592.193940 5 0xef0000b8 0x521c022a 0x0 0
W 4 592.193943 5 0xef0000b8 0xd21cd0a7 0x0 0
R 4 592.193946 5 0xef0000b8 0x521cd0a7 0x0 0
W 4 592.193948 5 0xef0000b8 0xd21cd1b9 0x0 0
R 4 592.193952 5 0xef0000b8 0x521cd1b9 0x0 0
W 4 592.193954 5 0xef0000b8 0xd21ca208 0x0 0
R 4 592.193958 5 0xef0000b8 0x521ca208 0x0 0
W 4 592.193960 5 0xef0000b8 0xd21c1000 0x0 0
R 4 592.193963 5 0xef0000b8 0x521c1000 0x0 0
W 4 592.193966 5 0xef0000b8 0xd21c080e 0x0 0
R 4 592.193969 5 0xef0000b8 0x521c080e 0x0 0
W 4 592.193971 5 0xef0000b8 0xd21cd701 0x0 0
R 4 592.193975 5 0xef0000b8 0x521cd701 0x0 0
W 4 592.193977 5 0xef0000b8 0xd21c408b 0x0 0
R 4 592.193981 5 0xef0000b8 0x521c408b 0x0 0
W 4 592.193983 5 0xef0000b8 0xd21c1000 0x0 0
R 4 592.193986 5 0xef0000b8 0x521c1000 0x0 0
W 4 592.193989 5 0xef0000b8 0xd21c0a65 0x0 0
R 4 592.193992 5 0xef0000b8 0x521c0a65 0x0 0
W 4 592.193994 5 0xef0000b8 0xd21cf003 0x0 0
R 4 592.193998 5 0xef0000b8 0x521cf003 0x0 0
W 4 592.194000 5 0xef0000b8 0xd21c1000 0x0 0
R 4 592.194004 5 0xef0000b8 0x521c1000 0x0 0
W 4 592.194006 5 0xef0000b8 0xd21c0a6b 0x0 0
R 4 592.194009 5 0xef0000b8 0x521c0a6b 0x0 0
W 4 592.194012 5 0xef0000b8 0xd21cd701 0x0 0
R 4 592.194015 5 0xef0000b8 0x521cd701 0x0 0
W 4 592.194017 5 0xef0000b8 0xd21c1000 0x0 0
R 4 592.194021 5 0xef0000b8 0x521c1000 0x0 0
W 4 592.194023 5 0xef0000b8 0xd21c0920 0x0 0
R 4 592.194027 5 0xef0000b8 0x521c0920 0x0 0
W 4 592.194029 5 0xef0000b8 0xd21c1000 0x0 0
R 4 592.194032 5 0xef0000b8 0x521c1000 0x0 0
W 4 592.194035 5 0xef0000b8 0xd21c0915 0x0 0
R 4 592.194038 5 0xef0000b8 0x521c0915 0x0 0
W 4 592.194040 5 0xef0000b8 0xd21c1000 0x0 0
R 4 592.194044 5 0xef0000b8 0x521c1000 0x0 0
W 4 592.194046 5 0xef0000b8 0xd21c0909 0x0 0
R 4 592.194050 5 0xef0000b8 0x521c0909 0x0 0
W 4 592.194052 5 0xef0000b8 0xd21c228f 0x0 0
R 4 592.194055 5 0xef0000b8 0x521c228f 0x0 0
W 4 592.194058 5 0xef0000b8 0xd21c8038 0x0 0
R 4 592.194061 5 0xef0000b8 0x521c8038 0x0 0
W 4 592.194064 5 0xef0000b8 0xd21c9801 0x0 0
R 4 592.194067 5 0xef0000b8 0x521c9801 0x0 0
W 4 592.194069 5 0xef0000b8 0xd21cd71e 0x0 0
R 4 592.194073 5 0xef0000b8 0x521cd71e 0x0 0
W 4 592.194075 5 0xef0000b8 0xd21c5d61 0x0 0
R 4 592.194078 5 0xef0000b8 0x521c5d61 0x0 0
W 4 592.194081 5 0xef0000b8 0xd21cd701 0x0 0
R 4 592.194084 5 0xef0000b8 0x521cd701 0x0 0
W 4 592.194087 5 0xef0000b8 0xd21c1800 0x0 0
R 4 592.194090 5 0xef0000b8 0x521c1800 0x0 0
W 4 592.194092 5 0xef0000b8 0xd21c022a 0x0 0
R 4 592.194096 5 0xef0000b8 0x521c022a 0x0 0
W 4 592.194098 5 0xef0000b8 0xd21c2005 0x0 0
R 4 592.194101 5 0xef0000b8 0x521c2005 0x0 0
W 4 592.194104 5 0xef0000b8 0xd21c091a 0x0 0
R 4 592.194107 5 0xef0000b8 0x521c091a 0x0 0
W 4 592.194110 5 0xef0000b8 0xd21c3bd9 0x0 0
R 4 592.194113 5 0xef0000b8 0x521c3bd9 0x0 0
W 4 592.194115 5 0xef0000b8 0xd21c0919 0x0 0
R 4 592.194119 5 0xef0000b8 0x521c0919 0x0 0
W 4 592.194121 5 0xef0000b8 0xd21c1800 0x0 0
R 4 592.194124 5 0xef0000b8 0x521c1800 0x0 0
W 4 592.194127 5 0xef0000b8 0xd21c0916 0x0 0
R 4 592.194130 5 0xef0000b8 0x521c0916 0x0 0
W 4 592.194133 5 0xef0000b8 0xd21c1000 0x0 0
R 4 592.194136 5 0xef0000b8 0x521c1000 0x0 0
W 4 592.194138 5 0xef0000b8 0xd21c14c5 0x0 0
R 4 592.194142 5 0xef0000b8 0x521c14c5 0x0 0
W 4 592.194144 5 0xef0000b8 0xd21cd703 0x0 0
R 4 592.194147 5 0xef0000b8 0x521cd703 0x0 0
W 4 592.194150 5 0xef0000b8 0xd21c3181 0x0 0
R 4 592.194153 5 0xef0000b8 0x521c3181 0x0 0
W 4 592.194156 5 0xef0000b8 0xd21c8061 0x0 0
R 4 592.194159 5 0xef0000b8 0x521c8061 0x0 0
W 4 592.194161 5 0xef0000b8 0xd21c60ad 0x0 0
R 4 592.194165 5 0xef0000b8 0x521c60ad 0x0 0
W 4 592.194167 5 0xef0000b8 0xd21c1000 0x0 0
R 4 592.194170 5 0xef0000b8 0x521c1000 0x0 0
W 4 592.194173 5 0xef0000b8 0xd21c135c 0x0 0
R 4 592.194176 5 0xef0000b8 0x521c135c 0x0 0
W 4 592.194179 5 0xef0000b8 0xd21cd703 0x0 0
R 4 592.194182 5 0xef0000b8 0x521cd703 0x0 0
W 4 592.194184 5 0xef0000b8 0xd21c5fba 0x0 0
R 4 592.194188 5 0xef0000b8 0x521c5fba 0x0 0
W 4 592.194190 5 0xef0000b8 0xd21c1800 0x0 0
R 4 592.194193 5 0xef0000b8 0x521c1800 0x0 0
W 4 592.194196 5 0xef0000b8 0xd21c0cc7 0x0 0
R 4 592.194199 5 0xef0000b8 0x521c0cc7 0x0 0
W 4 592.194202 5 0xef0000b8 0xd21cd096 0x0 0
R 4 592.194205 5 0xef0000b8 0x521cd096 0x0 0
W 4 592.194207 5 0xef0000b8 0xd21cd1a9 0x0 0
R 4 592.194211 5 0xef0000b8 0x521cd1a9 0x0 0
W 4 592.194213 5 0xef0000b8 0xd21cd503 0x0 0
R 4 592.194216 5 0xef0000b8 0x521cd503 0x0 0
W 4 592.194219 5 0xef0000b8 0xd21c1800 0x0 0
R 4 592.194222 5 0xef0000b8 0x521c1800 0x0 0
W 4 592.194225 5 0xef0000b8 0xd21c0c94 0x0 0
R 4 592.194228 5 0xef0000b8 0x521c0c94 0x0 0
W 4 592.194230 5 0xef0000b8 0xd21ba026 0x0 0
R 4 592.194234 5 0xef0000b8 0x521ba026 0x0 0
W 4 592.194236 5 0xef0000b8 0xd21cffff 0x0 0
R 4 592.194239 5 0xef0000b8 0x521cffff 0x0 0
W 4 592.194242 5 0xef0000b8 0xd21ba024 0x0 0
R 4 592.194245 5 0xef0000b8 0x521ba024 0x0 0
W 4 592.194248 5 0xef0000b8 0xd21c0c93 0x0 0
R 4 592.194251 5 0xef0000b8 0x521c0c93 0x0 0
W 4 592.194253 5 0xef0000b8 0xd21ba022 0x0 0
R 4 592.194257 5 0xef0000b8 0x521ba022 0x0 0
W 4 592.194259 5 0xef0000b8 0xd21c0cc5 0x0 0
R 4 592.194262 5 0xef0000b8 0x521c0cc5 0x0 0
W 4 592.194265 5 0xef0000b8 0xd21ba020 0x0 0
R 4 592.194268 5 0xef0000b8 0x521ba020 0x0 0
W 4 592.194271 5 0xef0000b8 0xd21c0915 0x0 0
R 4 592.194274 5 0xef0000b8 0x521c0915 0x0 0
W 4 592.194276 5 0xef0000b8 0xd21ba006 0x0 0
R 4 592.194280 5 0xef0000b8 0x521ba006 0x0 0
W 4 592.194282 5 0xef0000b8 0xd21c020a 0x0 0
R 4 592.194285 5 0xef0000b8 0x521c020a 0x0 0
W 4 592.194288 5 0xef0000b8 0xd21ba004 0x0 0
R 4 592.194291 5 0xef0000b8 0x521ba004 0x0 0
W 4 592.194293 5 0xef0000b8 0xd21c155b 0x0 0
R 4 592.194297 5 0xef0000b8 0x521c155b 0x0 0
W 4 592.194299 5 0xef0000b8 0xd21ba002 0x0 0
R 4 592.194303 5 0xef0000b8 0x521ba002 0x0 0
W 4 592.194305 5 0xef0000b8 0xd21c1542 0x0 0
R 4 592.194308 5 0xef0000b8 0x521c1542 0x0 0
W 4 592.194311 5 0xef0000b8 0xd21ba000 0x0 0
R 4 592.194314 5 0xef0000b8 0x521ba000 0x0 0
W 4 592.194317 5 0xef0000b8 0xd21c0fc7 0x0 0
R 4 592.194320 5 0xef0000b8 0x521c0fc7 0x0 0
W 4 592.194322 5 0xef0000b8 0xd21ba008 0x0 0
R 4 592.194326 5 0xef0000b8 0x521ba008 0x0 0
W 4 592.194328 5 0xef0000b8 0xd21c7f00 0x0 0
R 4 592.194332 5 0xef0000b8 0x521c7f00 0x0 0
W 4 592.194338 5 0xef0000b8 0xd21ba016 0x0 0
R 4 592.194341 5 0xef0000b8 0x521ba016 0x0 0
W 4 592.194343 5 0xef0000b8 0xd21c0010 0x0 0
R 4 592.194347 5 0xef0000b8 0x521c0010 0x0 0
W 4 592.194349 5 0xef0000b8 0xd21ba012 0x0 0
R 4 592.194353 5 0xef0000b8 0x521ba012 0x0 0
W 4 592.194355 5 0xef0000b8 0xd21c0000 0x0 0
R 4 592.194358 5 0xef0000b8 0x521c0000 0x0 0
W 4 592.194361 5 0xef0000b8 0xd21ba014 0x0 0
R 4 592.194364 5 0xef0000b8 0x521ba014 0x0 0
W 4 592.194366 5 0xef0000b8 0xd21c1800 0x0 0
R 4 592.194370 5 0xef0000b8 0x521c1800 0x0 0
W 4 592.194372 5 0xef0000b8 0xd21c8010 0x0 0
R 4 592.194375 5 0xef0000b8 0x521c8010 0x0 0
W 4 592.194378 5 0xef0000b8 0xd21c1800 0x0 0
R 4 592.194381 5 0xef0000b8 0x521c1800 0x0 0
W 4 592.194384 5 0xef0000b8 0xd21c801d 0x0 0
R 4 592.194387 5 0xef0000b8 0x521c801d 0x0 0
W 4 592.194389 5 0xef0000b8 0xd21c1800 0x0 0
R 4 592.194393 5 0xef0000b8 0x521c1800 0x0 0
W 4 592.194419 5 0xef0000b8 0xd21c802c 0x0 0
R 4 592.194423 5 0xef0000b8 0x521c802c 0x0 0
W 4 592.194425 5 0xef0000b8 0xd21c1800 0x0 0
R 4 592.194429 5 0xef0000b8 0x521c1800 0x0 0
W 4 592.194431 5 0xef0000b8 0xd21c802c 0x0 0
R 4 592.194434 5 0xef0000b8 0x521c802c 0x0 0
W 4 592.194437 5 0xef0000b8 0xd21c1800 0x0 0
R 4 592.194440 5 0xef0000b8 0x521c1800 0x0 0
W 4 592.194442 5 0xef0000b8 0xd21c802c 0x0 0
R 4 592.194446 5 0xef0000b8 0x521c802c 0x0 0
W 4 592.194448 5 0xef0000b8 0xd21c1800 0x0 0
R 4 592.194452 5 0xef0000b8 0x521c1800 0x0 0
W 4 592.194454 5 0xef0000b8 0xd21c802c 0x0 0
R 4 592.194457 5 0xef0000b8 0x521c802c 0x0 0
W 4 592.194460 5 0xef0000b8 0xd21c1800 0x0 0
R 4 592.194463 5 0xef0000b8 0x521c1800 0x0 0
W 4 592.194465 5 0xef0000b8 0xd21c802c 0x0 0
R 4 592.194469 5 0xef0000b8 0x521c802c 0x0 0
W 4 592.194471 5 0xef0000b8 0xd21c1800 0x0 0
R 4 592.194475 5 0xef0000b8 0x521c1800 0x0 0
W 4 592.194477 5 0xef0000b8 0xd21c802c 0x0 0
R 4 592.194480 5 0xef0000b8 0x521c802c 0x0 0
W 4 592.194483 5 0xef0000b8 0xd21cd700 0x0 0
R 4 592.194486 5 0xef0000b8 0x521cd700 0x0 0
W 4 592.194488 5 0xef0000b8 0xd21c6090 0x0 0
R 4 592.194492 5 0xef0000b8 0x521c6090 0x0 0
W 4 592.194494 5 0xef0000b8 0xd21c60d1 0x0 0
R 4 592.194498 5 0xef0000b8 0x521c60d1 0x0 0
W 4 592.194500 5 0xef0000b8 0xd21cc95c 0x0 0
R 4 592.194503 5 0xef0000b8 0x521cc95c 0x0 0
W 4 592.194506 5 0xef0000b8 0xd21cf007 0x0 0
R 4 592.194509 5 0xef0000b8 0x521cf007 0x0 0
W 4 592.194511 5 0xef0000b8 0xd21c60b1 0x0 0
R 4 592.194515 5 0xef0000b8 0x521c60b1 0x0 0
W 4 592.194517 5 0xef0000b8 0xd21cc95a 0x0 0
R 4 592.194521 5 0xef0000b8 0x521cc95a 0x0 0
W 4 592.194523 5 0xef0000b8 0xd21cf004 0x0 0
R 4 592.194526 5 0xef0000b8 0x521cf004 0x0 0
W 4 592.194529 5 0xef0000b8 0xd21cc956 0x0 0
R 4 592.194532 5 0xef0000b8 0x521cc956 0x0 0
W 4 592.194534 5 0xef0000b8 0xd21cf002 0x0 0
R 4 592.194538 5 0xef0000b8 0x521cf002 0x0 0
W 4 592.194540 5 0xef0000b8 0xd21cc94e 0x0 0
R 4 592.194544 5 0xef0000b8 0x521cc94e 0x0 0
W 4 592.194546 5 0xef0000b8 0xd21c1800 0x0 0
R 4 592.194549 5 0xef0000b8 0x521c1800 0x0 0
W 4 592.194552 5 0xef0000b8 0xd21c00cd 0x0 0
R 4 592.194555 5 0xef0000b8 0x521c00cd 0x0 0
W 4 592.194557 5 0xef0000b8 0xd21cd700 0x0 0
R 4 592.194561 5 0xef0000b8 0x521cd700 0x0 0
W 4 592.194563 5 0xef0000b8 0xd21c6090 0x0 0
R 4 592.194567 5 0xef0000b8 0x521c6090 0x0 0
W 4 592.194569 5 0xef0000b8 0xd21c60d1 0x0 0
R 4 592.194572 5 0xef0000b8 0x521c60d1 0x0 0
W 4 592.194575 5 0xef0000b8 0xd21cc95c 0x0 0
R 4 592.194578 5 0xef0000b8 0x521cc95c 0x0 0
W 4 592.194580 5 0xef0000b8 0xd21cf007 0x0 0
R 4 592.194584 5 0xef0000b8 0x521cf007 0x0 0
W 4 592.194586 5 0xef0000b8 0xd21c60b1 0x0 0
R 4 592.194590 5 0xef0000b8 0x521c60b1 0x0 0
W 4 592.194592 5 0xef0000b8 0xd21cc95a 0x0 0
R 4 592.194595 5 0xef0000b8 0x521cc95a 0x0 0
W 4 592.194598 5 0xef0000b8 0xd21cf004 0x0 0
R 4 592.194601 5 0xef0000b8 0x521cf004 0x0 0
W 4 592.194603 5 0xef0000b8 0xd21cc956 0x0 0
R 4 592.194607 5 0xef0000b8 0x521cc956 0x0 0
W 4 592.194609 5 0xef0000b8 0xd21cf002 0x0 0
R 4 592.194613 5 0xef0000b8 0x521cf002 0x0 0
W 4 592.194615 5 0xef0000b8 0xd21cc94e 0x0 0
R 4 592.194618 5 0xef0000b8 0x521cc94e 0x0 0
W 4 592.194621 5 0xef0000b8 0xd21c1000 0x0 0
R 4 592.194624 5 0xef0000b8 0x521c1000 0x0 0
W 4 592.194627 5 0xef0000b8 0xd21c022a 0x0 0
R 4 592.194630 5 0xef0000b8 0x521c022a 0x0 0
W 4 592.194632 5 0xef0000b8 0xd21c1800 0x0 0
R 4 592.194636 5 0xef0000b8 0x521c1800 0x0 0
W 4 592.194638 5 0xef0000b8 0xd21c0132 0x0 0
R 4 592.194641 5 0xef0000b8 0x521c0132 0x0 0
W 4 592.194644 5 0xef0000b8 0xd21ba08e 0x0 0
R 4 592.194647 5 0xef0000b8 0x521ba08e 0x0 0
W 4 592.194650 5 0xef0000b8 0xd21cffff 0x0 0
R 4 592.194653 5 0xef0000b8 0x521cffff 0x0 0
W 4 592.194655 5 0xef0000b8 0xd21ba08c 0x0 0
R 4 592.194659 5 0xef0000b8 0x521ba08c 0x0 0
W 4 592.194661 5 0xef0000b8 0xd21cffff 0x0 0
R 4 592.194664 5 0xef0000b8 0x521cffff 0x0 0
W 4 592.194667 5 0xef0000b8 0xd21ba08a 0x0 0
R 4 592.194670 5 0xef0000b8 0x521ba08a 0x0 0
W 4 592.194673 5 0xef0000b8 0xd21cffff 0x0 0
R 4 592.194676 5 0xef0000b8 0x521cffff 0x0 0
W 4 592.194679 5 0xef0000b8 0xd21ba088 0x0 0
R 4 592.194682 5 0xef0000b8 0x521ba088 0x0 0
W 4 592.194684 5 0xef0000b8 0xd21cffff 0x0 0
R 4 592.194688 5 0xef0000b8 0x521cffff 0x0 0
W 4 592.194690 5 0xef0000b8 0xd21ba086 0x0 0
R 4 592.194693 5 0xef0000b8 0x521ba086 0x0 0
W 4 592.194696 5 0xef0000b8 0xd21cffff 0x0 0
R 4 592.194699 5 0xef0000b8 0x521cffff 0x0 0
W 4 592.194702 5 0xef0000b8 0xd21ba084 0x0 0
R 4 592.194705 5 0xef0000b8 0x521ba084 0x0 0
W 4 592.194707 5 0xef0000b8 0xd21cffff 0x0 0
R 4 592.194711 5 0xef0000b8 0x521cffff 0x0 0
W 4 592.194713 5 0xef0000b8 0xd21ba082 0x0 0
R 4 592.194717 5 0xef0000b8 0x521ba082 0x0 0
W 4 592.194719 5 0xef0000b8 0xd21c012f 0x0 0
R 4 592.194722 5 0xef0000b8 0x521c012f 0x0 0
W 4 592.194725 5 0xef0000b8 0xd21ba080 0x0 0
R 4 592.194728 5 0xef0000b8 0x521ba080 0x0 0
W 4 592.194730 5 0xef0000b8 0xd21c00cc 0x0 0
R 4 592.194734 5 0xef0000b8 0x521c00cc 0x0 0
W 4 592.194736 5 0xef0000b8 0xd21ba090 0x0 0
R 4 592.194740 5 0xef0000b8 0x521ba090 0x0 0
W 4 592.194742 5 0xef0000b8 0xd21c0103 0x0 0
R 4 592.194745 5 0xef0000b8 0x521c0103 0x0 0
W 4 592.194748 5 0xef0000b8 0xd21ba016 0x0 0
R 4 592.194751 5 0xef0000b8 0x521ba016 0x0 0
W 4 592.194753 5 0xef0000b8 0xd21c0020 0x0 0
R 4 592.194757 5 0xef0000b8 0x521c0020 0x0 0
W 4 592.194759 5 0xef0000b8 0xd21ba012 0x0 0
R 4 592.194762 5 0xef0000b8 0x521ba012 0x0 0
W 4 592.194765 5 0xef0000b8 0xd21c0000 0x0 0
R 4 592.194768 5 0xef0000b8 0x521c0000 0x0 0
W 4 592.194771 5 0xef0000b8 0xd21ba014 0x0 0
R 4 592.194774 5 0xef0000b8 0x521ba014 0x0 0
W 4 592.194776 5 0xef0000b8 0xd21c1800 0x0 0
R 4 592.194780 5 0xef0000b8 0x521c1800 0x0 0
W 4 592.194782 5 0xef0000b8 0xd21c8010 0x0 0
R 4 592.194785 5 0xef0000b8 0x521c8010 0x0 0
W 4 592.194788 5 0xef0000b8 0xd21c1800 0x0 0
R 4 592.194791 5 0xef0000b8 0x521c1800 0x0 0
W 4 592.194794 5 0xef0000b8 0xd21c8020 0x0 0
R 4 592.194797 5 0xef0000b8 0x521c8020 0x0 0
W 4 592.194799 5 0xef0000b8 0xd21c1800 0x0 0
R 4 592.194803 5 0xef0000b8 0x521c1800 0x0 0
W 4 592.194805 5 0xef0000b8 0xd21c802a 0x0 0
R 4 592.194809 5 0xef0000b8 0x521c802a 0x0 0
W 4 592.194811 5 0xef0000b8 0xd21c1800 0x0 0
R 4 592.194814 5 0xef0000b8 0x521c1800 0x0 0
W 4 592.194817 5 0xef0000b8 0xd21c8035 0x0 0
R 4 592.194820 5 0xef0000b8 0x521c8035 0x0 0
W 4 592.194822 5 0xef0000b8 0xd21c1800 0x0 0
R 4 592.194826 5 0xef0000b8 0x521c1800 0x0 0
W 4 592.194828 5 0xef0000b8 0xd21c803c 0x0 0
R 4 592.194832 5 0xef0000b8 0x521c803c 0x0 0
W 4 592.194834 5 0xef0000b8 0xd21c1800 0x0 0
R 4 592.194837 5 0xef0000b8 0x521c1800 0x0 0
W 4 592.194840 5 0xef0000b8 0xd21c803c 0x0 0
R 4 592.194843 5 0xef0000b8 0x521c803c 0x0 0
W 4 592.194845 5 0xef0000b8 0xd21c1800 0x0 0
R 4 592.194849 5 0xef0000b8 0x521c1800 0x0 0
W 4 592.194851 5 0xef0000b8 0xd21c803c 0x0 0
R 4 592.194854 5 0xef0000b8 0x521c803c 0x0 0
W 4 592.194857 5 0xef0000b8 0xd21c1800 0x0 0
R 4 592.194860 5 0xef0000b8 0x521c1800 0x0 0
W 4 592.194863 5 0xef0000b8 0xd21c803c 0x0 0
R 4 592.194866 5 0xef0000b8 0x521c803c 0x0 0
W 4 592.194868 5 0xef0000b8 0xd21cd107 0x0 0
R 4 592.194872 5 0xef0000b8 0x521cd107 0x0 0
W 4 592.194874 5 0xef0000b8 0xd21cd042 0x0 0
R 4 592.194878 5 0xef0000b8 0x521cd042 0x0 0
W 4 592.194880 5 0xef0000b8 0xd21ca404 0x0 0
R 4 592.194884 5 0xef0000b8 0x521ca404 0x0 0
W 4 592.194886 5 0xef0000b8 0xd21c1000 0x0 0
R 4 592.194889 5 0xef0000b8 0x521c1000 0x0 0
W 4 592.194892 5 0xef0000b8 0xd21c09df 0x0 0
R 4 592.194895 5 0xef0000b8 0x521c09df 0x0 0
W 4 592.194898 5 0xef0000b8 0xd21cd700 0x0 0
R 4 592.194901 5 0xef0000b8 0x521cd700 0x0 0
W 4 592.194903 5 0xef0000b8 0xd21c5fb4 0x0 0
R 4 592.194907 5 0xef0000b8 0x521c5fb4 0x0 0
W 4 592.194909 5 0xef0000b8 0xd21c8280 0x0 0
R 4 592.194913 5 0xef0000b8 0x521c8280 0x0 0
W 4 592.194915 5 0xef0000b8 0xd21cd700 0x0 0
R 4 592.194918 5 0xef0000b8 0x521cd700 0x0 0
W 4 592.194921 5 0xef0000b8 0xd21c6065 0x0 0
R 4 592.194924 5 0xef0000b8 0x521c6065 0x0 0
W 4 592.194926 5 0xef0000b8 0xd21cd125 0x0 0
R 4 592.194930 5 0xef0000b8 0x521cd125 0x0 0
W 4 592.194932 5 0xef0000b8 0xd21cf002 0x0 0
R 4 592.194936 5 0xef0000b8 0x521cf002 0x0 0
W 4 592.194938 5 0xef0000b8 0xd21cd12b 0x0 0
R 4 592.194941 5 0xef0000b8 0x521cd12b 0x0 0
W 4 592.194944 5 0xef0000b8 0xd21cd040 0x0 0
R 4 592.194947 5 0xef0000b8 0x521cd040 0x0 0
W 4 592.194949 5 0xef0000b8 0xd21c1800 0x0 0
R 4 592.194953 5 0xef0000b8 0x521c1800 0x0 0
W 4 592.194955 5 0xef0000b8 0xd21c077f 0x0 0
R 4 592.194959 5 0xef0000b8 0x521c077f 0x0 0
W 4 592.194961 5 0xef0000b8 0xd21c0cf0 0x0 0
R 4 592.194964 5 0xef0000b8 0x521c0cf0 0x0 0
W 4 592.194967 5 0xef0000b8 0xd21c0c50 0x0 0
R 4 592.194970 5 0xef0000b8 0x521c0c50 0x0 0
W 4 592.194972 5 0xef0000b8 0xd21cd104 0x0 0
R 4 592.194976 5 0xef0000b8 0x521cd104 0x0 0
W 4 592.194978 5 0xef0000b8 0xd21cd040 0x0 0
R 4 592.194982 5 0xef0000b8 0x521cd040 0x0 0
W 4 592.194984 5 0xef0000b8 0xd21c1000 0x0 0
R 4 592.194987 5 0xef0000b8 0x521c1000 0x0 0
W 4 592.194990 5 0xef0000b8 0xd21c0aa8 0x0 0
R 4 592.194993 5 0xef0000b8 0x521c0aa8 0x0 0
W 4 592.194995 5 0xef0000b8 0xd21cd700 0x0 0
R 4 592.194999 5 0xef0000b8 0x521cd700 0x0 0
W 4 592.195001 5 0xef0000b8 0xd21c5fb4 0x0 0
R 4 592.195005 5 0xef0000b8 0x521c5fb4 0x0 0
W 4 592.195007 5 0xef0000b8 0xd21c1800 0x0 0
R 4 592.195010 5 0xef0000b8 0x521c1800 0x0 0
W 4 592.195013 5 0xef0000b8 0xd21c0a2e 0x0 0
R 4 592.195016 5 0xef0000b8 0x521c0a2e 0x0 0
W 4 592.195018 5 0xef0000b8 0xd21ccb9b 0x0 0
R 4 592.195022 5 0xef0000b8 0x521ccb9b 0x0 0
W 4 592.195024 5 0xef0000b8 0xd21cd110 0x0 0
R 4 592.195028 5 0xef0000b8 0x521cd110 0x0 0
W 4 592.195030 5 0xef0000b8 0xd21cd040 0x0 0
R 4 592.195033 5 0xef0000b8 0x521cd040 0x0 0
W 4 592.195036 5 0xef0000b8 0xd21c1000 0x0 0
R 4 592.195039 5 0xef0000b8 0x521c1000 0x0 0
W 4 592.195041 5 0xef0000b8 0xd21c0b7b 0x0 0
R 4 592.195045 5 0xef0000b8 0x521c0b7b 0x0 0
W 4 592.195047 5 0xef0000b8 0xd21c1000 0x0 0
R 4 592.195051 5 0xef0000b8 0x521c1000 0x0 0
W 4 592.195053 5 0xef0000b8 0xd21c09df 0x0 0
R 4 592.195056 5 0xef0000b8 0x521c09df 0x0 0
W 4 592.195059 5 0xef0000b8 0xd21cd700 0x0 0
R 4 592.195062 5 0xef0000b8 0x521cd700 0x0 0
W 4 592.195064 5 0xef0000b8 0xd21c5fb4 0x0 0
R 4 592.195068 5 0xef0000b8 0x521c5fb4 0x0 0
W 4 592.195070 5 0xef0000b8 0xd21c1800 0x0 0
R 4 592.195074 5 0xef0000b8 0x521c1800 0x0 0
W 4 592.195076 5 0xef0000b8 0xd21c081b 0x0 0
R 4 592.195079 5 0xef0000b8 0x521c081b 0x0 0
W 4 592.195082 5 0xef0000b8 0xd21c1000 0x0 0
R 4 592.195085 5 0xef0000b8 0x521c1000 0x0 0
W 4 592.195087 5 0xef0000b8 0xd21c09df 0x0 0
R 4 592.195091 5 0xef0000b8 0x521c09df 0x0 0
W 4 592.195093 5 0xef0000b8 0xd21cd704 0x0 0
R 4 592.195097 5 0xef0000b8 0x521cd704 0x0 0
W 4 592.195099 5 0xef0000b8 0xd21c7fb8 0x0 0
R 4 592.195102 5 0xef0000b8 0x521c7fb8 0x0 0
W 4 592.195105 5 0xef0000b8 0xd21ca718 0x0 0
R 4 592.195108 5 0xef0000b8 0x521ca718 0x0 0
W 4 592.195110 5 0xef0000b8 0xd21c1800 0x0 0
R 4 592.195114 5 0xef0000b8 0x521c1800 0x0 0
W 4 592.195116 5 0xef0000b8 0xd21c074e 0x0 0
R 4 592.195120 5 0xef0000b8 0x521c074e 0x0 0
W 4 592.195122 5 0xef0000b8 0xd21ba10e 0x0 0
R 4 592.195125 5 0xef0000b8 0x521ba10e 0x0 0
W 4 592.195128 5 0xef0000b8 0xd21cffff 0x0 0
R 4 592.195131 5 0xef0000b8 0x521cffff 0x0 0
W 4 592.195133 5 0xef0000b8 0xd21ba10c 0x0 0
R 4 592.195137 5 0xef0000b8 0x521ba10c 0x0 0
W 4 592.195139 5 0xef0000b8 0xd21cffff 0x0 0
R 4 592.195143 5 0xef0000b8 0x521cffff 0x0 0
W 4 592.195145 5 0xef0000b8 0xd21ba10a 0x0 0
R 4 592.195148 5 0xef0000b8 0x521ba10a 0x0 0
W 4 592.195151 5 0xef0000b8 0xd21cffff 0x0 0
R 4 592.195154 5 0xef0000b8 0x521cffff 0x0 0
W 4 592.195157 5 0xef0000b8 0xd21ba108 0x0 0
R 4 592.195160 5 0xef0000b8 0x521ba108 0x0 0
W 4 592.195162 5 0xef0000b8 0xd21cffff 0x0 0
R 4 592.195166 5 0xef0000b8 0x521cffff 0x0 0
W 4 592.195168 5 0xef0000b8 0xd21ba106 0x0 0
R 4 592.195171 5 0xef0000b8 0x521ba106 0x0 0
W 4 592.195174 5 0xef0000b8 0xd21c074d 0x0 0
R 4 592.195177 5 0xef0000b8 0x521c074d 0x0 0
W 4 592.195180 5 0xef0000b8 0xd21ba104 0x0 0
R 4 592.195183 5 0xef0000b8 0x521ba104 0x0 0
W 4 592.195185 5 0xef0000b8 0xd21c0818 0x0 0
R 4 592.195189 5 0xef0000b8 0x521c0818 0x0 0
W 4 592.195191 5 0xef0000b8 0xd21ba102 0x0 0
R 4 592.195194 5 0xef0000b8 0x521ba102 0x0 0
W 4 592.195197 5 0xef0000b8 0xd21c0a2c 0x0 0
R 4 592.195200 5 0xef0000b8 0x521c0a2c 0x0 0
W 4 592.195202 5 0xef0000b8 0xd21ba100 0x0 0
R 4 592.195206 5 0xef0000b8 0x521ba100 0x0 0
W 4 592.195208 5 0xef0000b8 0xd21c077e 0x0 0
R 4 592.195212 5 0xef0000b8 0x521c077e 0x0 0
W 4 592.195214 5 0xef0000b8 0xd21ba110 0x0 0
R 4 592.195217 5 0xef0000b8 0x521ba110 0x0 0
W 4 592.195220 5 0xef0000b8 0xd21c000f 0x0 0
R 4 592.195223 5 0xef0000b8 0x521c000f 0x0 0
W 4 592.195225 5 0xef0000b8 0xd21bb87c 0x0 0
R 4 592.195229 5 0xef0000b8 0x521bb87c 0x0 0
W 4 592.195231 5 0xef0000b8 0xd21c8625 0x0 0
R 4 592.195235 5 0xef0000b8 0x521c8625 0x0 0
W 4 592.195237 5 0xef0000b8 0xd21bb87e 0x0 0
R 4 592.195240 5 0xef0000b8 0x521bb87e 0x0 0
W 4 592.195243 5 0xef0000b8 0xd21caf86 0x0 0
R 4 592.195246 5 0xef0000b8 0x521caf86 0x0 0
W 4 592.195248 5 0xef0000b8 0xd21c3daf 0x0 0
R 4 592.195252 5 0xef0000b8 0x521c3daf 0x0 0
W 4 592.195254 5 0xef0000b8 0xd21c8689 0x0 0
R 4 592.195258 5 0xef0000b8 0x521c8689 0x0 0
W 4 592.195260 5 0xef0000b8 0xd21caf88 0x0 0
R 4 592.195263 5 0xef0000b8 0x521caf88 0x0 0
W 4 592.195266 5 0xef0000b8 0xd21c69af 0x0 0
R 4 592.195269 5 0xef0000b8 0x521c69af 0x0 0
W 4 592.195271 5 0xef0000b8 0xd21c8887 0x0 0
R 4 592.195275 5 0xef0000b8 0x521c8887 0x0 0
W 4 592.195277 5 0xef0000b8 0xd21caf88 0x0 0
R 4 592.195281 5 0xef0000b8 0x521caf88 0x0 0
W 4 592.195283 5 0xef0000b8 0xd21c9caf 0x0 0
R 4 592.195286 5 0xef0000b8 0x521c9caf 0x0 0
W 4 592.195289 5 0xef0000b8 0xd21c889c 0x0 0
R 4 592.195292 5 0xef0000b8 0x521c889c 0x0 0
W 4 592.195294 5 0xef0000b8 0xd21caf88 0x0 0
R 4 592.195298 5 0xef0000b8 0x521caf88 0x0 0
W 4 592.195300 5 0xef0000b8 0xd21c9caf 0x0 0
R 4 592.195304 5 0xef0000b8 0x521c9caf 0x0 0
W 4 592.195306 5 0xef0000b8 0xd21c889c 0x0 0
R 4 592.195309 5 0xef0000b8 0x521c889c 0x0 0
W 4 592.195312 5 0xef0000b8 0xd21cbf86 0x0 0
R 4 592.195315 5 0xef0000b8 0x521cbf86 0x0 0
W 4 592.195317 5 0xef0000b8 0xd21c49d7 0x0 0
R 4 592.195321 5 0xef0000b8 0x521c49d7 0x0 0
W 4 592.195323 5 0xef0000b8 0xd21c0040 0x0 0
R 4 592.195327 5 0xef0000b8 0x521c0040 0x0 0
W 4 592.195329 5 0xef0000b8 0xd21c0277 0x0 0
R 4 592.195332 5 0xef0000b8 0x521c0277 0x0 0
W 4 592.195338 5 0xef0000b8 0xd21c7daf 0x0 0
R 4 592.195341 5 0xef0000b8 0x521c7daf 0x0 0
W 4 592.195343 5 0xef0000b8 0xd21c2727 0x0 0
R 4 592.195347 5 0xef0000b8 0x521c2727 0x0 0
W 4 592.195349 5 0xef0000b8 0xd21c0000 0x0 0
R 4 592.195353 5 0xef0000b8 0x521c0000 0x0 0
W 4 592.195355 5 0xef0000b8 0xd21c7205 0x0 0
R 4 592.195358 5 0xef0000b8 0x521c7205 0x0 0
W 4 592.195361 5 0xef0000b8 0xd21c0000 0x0 0
R 4 592.195364 5 0xef0000b8 0x521c0000 0x0 0
W 4 592.195366 5 0xef0000b8 0xd21c7208 0x0 0
R 4 592.195370 5 0xef0000b8 0x521c7208 0x0 0
W 4 592.195372 5 0xef0000b8 0xd21c0000 0x0 0
R 4 592.195376 5 0xef0000b8 0x521c0000 0x0 0
W 4 592.195378 5 0xef0000b8 0xd21c71f3 0x0 0
R 4 592.195381 5 0xef0000b8 0x521c71f3 0x0 0
W 4 592.195384 5 0xef0000b8 0xd21c0000 0x0 0
R 4 592.195387 5 0xef0000b8 0x521c0000 0x0 0
W 4 592.195389 5 0xef0000b8 0xd21c71f6 0x0 0
R 4 592.195393 5 0xef0000b8 0x521c71f6 0x0 0
W 4 592.195395 5 0xef0000b8 0xd21c0000 0x0 0
R 4 592.195399 5 0xef0000b8 0x521c0000 0x0 0
W 4 592.195401 5 0xef0000b8 0xd21c7229 0x0 0
R 4 592.195404 5 0xef0000b8 0x521c7229 0x0 0
W 4 592.195407 5 0xef0000b8 0xd21c0000 0x0 0
R 4 592.195410 5 0xef0000b8 0x521c0000 0x0 0
W 4 592.195413 5 0xef0000b8 0xd21c722c 0x0 0
R 4 592.195416 5 0xef0000b8 0x521c722c 0x0 0
W 4 592.195418 5 0xef0000b8 0xd21c0000 0x0 0
R 4 592.195422 5 0xef0000b8 0x521c0000 0x0 0
W 4 592.195424 5 0xef0000b8 0xd21c7217 0x0 0
R 4 592.195428 5 0xef0000b8 0x521c7217 0x0 0
W 4 592.195430 5 0xef0000b8 0xd21c0000 0x0 0
R 4 592.195433 5 0xef0000b8 0x521c0000 0x0 0
W 4 592.195436 5 0xef0000b8 0xd21c721a 0x0 0
R 4 592.195439 5 0xef0000b8 0x521c721a 0x0 0
W 4 592.195441 5 0xef0000b8 0xd21c0000 0x0 0
R 4 592.195445 5 0xef0000b8 0x521c0000 0x0 0
W 4 592.195447 5 0xef0000b8 0xd21c721d 0x0 0
R 4 592.195451 5 0xef0000b8 0x521c721d 0x0 0
W 4 592.195453 5 0xef0000b8 0xd21c0000 0x0 0
R 4 592.195456 5 0xef0000b8 0x521c0000 0x0 0
W 4 592.195459 5 0xef0000b8 0xd21c7211 0x0 0
R 4 592.195462 5 0xef0000b8 0x521c7211 0x0 0
W 4 592.195464 5 0xef0000b8 0xd21c0000 0x0 0
R 4 592.195468 5 0xef0000b8 0x521c0000 0x0 0
W 4 592.195470 5 0xef0000b8 0xd21c7220 0x0 0
R 4 592.195474 5 0xef0000b8 0x521c7220 0x0 0
W 4 592.195476 5 0xef0000b8 0xd21c0000 0x0 0
R 4 592.195480 5 0xef0000b8 0x521c0000 0x0 0
W 4 592.195482 5 0xef0000b8 0xd21c7214 0x0 0
R 4 592.195485 5 0xef0000b8 0x521c7214 0x0 0
W 4 592.195488 5 0xef0000b8 0xd21c0000 0x0 0
R 4 592.195491 5 0xef0000b8 0x521c0000 0x0 0
W 4 592.195493 5 0xef0000b8 0xd21c722f 0x0 0
R 4 592.195497 5 0xef0000b8 0x521c722f 0x0 0
W 4 592.195499 5 0xef0000b8 0xd21c0000 0x0 0
R 4 592.195503 5 0xef0000b8 0x521c0000 0x0 0
W 4 592.195505 5 0xef0000b8 0xd21c7223 0x0 0
R 4 592.195508 5 0xef0000b8 0x521c7223 0x0 0
W 4 592.195511 5 0xef0000b8 0xd21c0000 0x0 0
R 4 592.195514 5 0xef0000b8 0x521c0000 0x0 0
W 4 592.195516 5 0xef0000b8 0xd21c7232 0x0 0
R 4 592.195520 5 0xef0000b8 0x521c7232 0x0 0
W 4 592.195522 5 0xef0000b8 0xd21c0000 0x0 0
R 4 592.195526 5 0xef0000b8 0x521c0000 0x0 0
W 4 592.195528 5 0xef0000b8 0xd21c7226 0x0 0
R 4 592.195531 5 0xef0000b8 0x521c7226 0x0 0
W 4 592.195534 5 0xef0000b8 0xd21cf8f9 0x0 0
R 4 592.195537 5 0xef0000b8 0x521cf8f9 0x0 0
W 4 592.195539 5 0xef0000b8 0xd21cfae0 0x0 0
R 4 592.195543 5 0xef0000b8 0x521cfae0 0x0 0
W 4 592.195545 5 0xef0000b8 0xd21c85b3 0x0 0
R 4 592.195549 5 0xef0000b8 0x521c85b3 0x0 0
W 4 592.195551 5 0xef0000b8 0xd21c3802 0x0 0
R 4 592.195554 5 0xef0000b8 0x521c3802 0x0 0
W 4 592.195557 5 0xef0000b8 0xd21cad27 0x0 0
R 4 592.195560 5 0xef0000b8 0x521cad27 0x0 0
W 4 592.195562 5 0xef0000b8 0xd21c02ae 0x0 0
R 4 592.195566 5 0xef0000b8 0x521c02ae 0x0 0
W 4 592.195568 5 0xef0000b8 0xd21c03af 0x0 0
R 4 592.195572 5 0xef0000b8 0x521c03af 0x0 0
W 4 592.195574 5 0xef0000b8 0xd21c8830 0x0 0
R 4 592.195577 5 0xef0000b8 0x521c8830 0x0 0
W 4 592.195580 5 0xef0000b8 0xd21c1f66 0x0 0
R 4 592.195583 5 0xef0000b8 0x521c1f66 0x0 0
W 4 592.195585 5 0xef0000b8 0xd21cef65 0x0 0
R 4 592.195589 5 0xef0000b8 0x521cef65 0x0 0
W 4 592.195591 5 0xef0000b8 0xd21cbfc2 0x0 0
R 4 592.195595 5 0xef0000b8 0x521cbfc2 0x0 0
W 4 592.195597 5 0xef0000b8 0xd21c1f1a 0x0 0
R 4 592.195600 5 0xef0000b8 0x521c1f1a 0x0 0
W 4 592.195603 5 0xef0000b8 0xd21c96f7 0x0 0
R 4 592.195606 5 0xef0000b8 0x521c96f7 0x0 0
W 4 592.195608 5 0xef0000b8 0xd21c05ee 0x0 0
R 4 592.195612 5 0xef0000b8 0x521c05ee 0x0 0
W 4 592.195614 5 0xef0000b8 0xd21cffd2 0x0 0
R 4 592.195617 5 0xef0000b8 0x521cffd2 0x0 0
W 4 592.195620 5 0xef0000b8 0xd21c00da 0x0 0
R 4 592.195623 5 0xef0000b8 0x521c00da 0x0 0
W 4 592.195626 5 0xef0000b8 0xd21cf605 0x0 0
R 4 592.195629 5 0xef0000b8 0x521cf605 0x0 0
W 4 592.195631 5 0xef0000b8 0xd21cbfc2 0x0 0
R 4 592.195635 5 0xef0000b8 0x521cbfc2 0x0 0
W 4 592.195637 5 0xef0000b8 0xd21c2f1a 0x0 0
R 4 592.195641 5 0xef0000b8 0x521c2f1a 0x0 0
W 4 592.195643 5 0xef0000b8 0xd21c96f7 0x0 0
R 4 592.195646 5 0xef0000b8 0x521c96f7 0x0 0
W 4 592.195649 5 0xef0000b8 0xd21c05ee 0x0 0
R 4 592.195652 5 0xef0000b8 0x521c05ee 0x0 0
W 4 592.195654 5 0xef0000b8 0xd21cffd2 0x0 0
R 4 592.195658 5 0xef0000b8 0x521cffd2 0x0 0
W 4 592.195660 5 0xef0000b8 0xd21c00db 0x0 0
R 4 592.195664 5 0xef0000b8 0x521c00db 0x0 0
W 4 592.195666 5 0xef0000b8 0xd21cf605 0x0 0
R 4 592.195669 5 0xef0000b8 0x521cf605 0x0 0
W 4 592.195672 5 0xef0000b8 0xd21cef02 0x0 0
R 4 592.195675 5 0xef0000b8 0x521cef02 0x0 0
W 4 592.195678 5 0xef0000b8 0xd21c1f11 0x0 0
R 4 592.195681 5 0xef0000b8 0x521c1f11 0x0 0
W 4 592.195683 5 0xef0000b8 0xd21c0d42 0x0 0
R 4 592.195687 5 0xef0000b8 0x521c0d42 0x0 0
W 4 592.195689 5 0xef0000b8 0xd21cbf88 0x0 0
R 4 592.195693 5 0xef0000b8 0x521cbf88 0x0 0
W 4 592.195695 5 0xef0000b8 0xd21c4202 0x0 0
R 4 592.195699 5 0xef0000b8 0x521c4202 0x0 0
W 4 592.195701 5 0xef0000b8 0xd21c6e7d 0x0 0
R 4 592.195704 5 0xef0000b8 0x521c6e7d 0x0 0
W 4 592.195707 5 0xef0000b8 0xd21cef02 0x0 0
R 4 592.195710 5 0xef0000b8 0x521cef02 0x0 0
W 4 592.195712 5 0xef0000b8 0xd21c1b03 0x0 0
R 4 592.195716 5 0xef0000b8 0x521c1b03 0x0 0
W 4 592.195718 5 0xef0000b8 0xd21c1f11 0x0 0
R 4 592.195722 5 0xef0000b8 0x521c1f11 0x0 0
W 4 592.195724 5 0xef0000b8 0xd21c0d42 0x0 0
R 4 592.195727 5 0xef0000b8 0x521c0d42 0x0 0
W 4 592.195730 5 0xef0000b8 0xd21cbf88 0x0 0
R 4 592.195733 5 0xef0000b8 0x521cbf88 0x0 0
W 4 592.195735 5 0xef0000b8 0xd21c4502 0x0 0
R 4 592.195739 5 0xef0000b8 0x521c4502 0x0 0
W 4 592.195741 5 0xef0000b8 0xd21c6e7d 0x0 0
R 4 592.195745 5 0xef0000b8 0x521c6e7d 0x0 0
W 4 592.195747 5 0xef0000b8 0xd21cef02 0x0 0
R 4 592.195750 5 0xef0000b8 0x521cef02 0x0 0
W 4 592.195753 5 0xef0000b8 0xd21c1a03 0x0 0
R 4 592.195756 5 0xef0000b8 0x521c1a03 0x0 0
W 4 592.195758 5 0xef0000b8 0xd21c1f11 0x0 0
R 4 592.195762 5 0xef0000b8 0x521c1f11 0x0 0
W 4 592.195764 5 0xef0000b8 0xd21c0d42 0x0 0
R 4 592.195768 5 0xef0000b8 0x521c0d42 0x0 0
W 4 592.195770 5 0xef0000b8 0xd21cbf88 0x0 0
R 4 592.195773 5 0xef0000b8 0x521cbf88 0x0 0
W 4 592.195776 5 0xef0000b8 0xd21c4802 0x0 0
R 4 592.195779 5 0xef0000b8 0x521c4802 0x0 0
W 4 592.195781 5 0xef0000b8 0xd21c6e7d 0x0 0
R 4 592.195785 5 0xef0000b8 0x521c6e7d 0x0 0
W 4 592.195787 5 0xef0000b8 0xd21cbfc2 0x0 0
R 4 592.195791 5 0xef0000b8 0x521cbfc2 0x0 0
W 4 592.195793 5 0xef0000b8 0xd21c3f1a 0x0 0
R 4 592.195796 5 0xef0000b8 0x521c3f1a 0x0 0
W 4 592.195799 5 0xef0000b8 0xd21c96f7 0x0 0
R 4 592.195802 5 0xef0000b8 0x521c96f7 0x0 0
W 4 592.195804 5 0xef0000b8 0xd21c05ee 0x0 0
R 4 592.195808 5 0xef0000b8 0x521c05ee 0x0 0
W 4 592.195810 5 0xef0000b8 0xd21cffd2 0x0 0
R 4 592.195814 5 0xef0000b8 0x521cffd2 0x0 0
W 4 592.195816 5 0xef0000b8 0xd21c00da 0x0 0
R 4 592.195819 5 0xef0000b8 0x521c00da 0x0 0
W 4 592.195822 5 0xef0000b8 0xd21cf605 0x0 0
R 4 592.195825 5 0xef0000b8 0x521cf605 0x0 0
W 4 592.195827 5 0xef0000b8 0xd21cbfc2 0x0 0
R 4 592.195831 5 0xef0000b8 0x521cbfc2 0x0 0
W 4 592.195833 5 0xef0000b8 0xd21c4f1a 0x0 0
R 4 592.195837 5 0xef0000b8 0x521c4f1a 0x0 0
W 4 592.195839 5 0xef0000b8 0xd21c96f7 0x0 0
R 4 592.195842 5 0xef0000b8 0x521c96f7 0x0 0
W 4 592.195845 5 0xef0000b8 0xd21c05ee 0x0 0
R 4 592.195848 5 0xef0000b8 0x521c05ee 0x0 0
W 4 592.195850 5 0xef0000b8 0xd21cffd2 0x0 0
R 4 592.195854 5 0xef0000b8 0x521cffd2 0x0 0
W 4 592.195856 5 0xef0000b8 0xd21c00db 0x0 0
R 4 592.195860 5 0xef0000b8 0x521c00db 0x0 0
W 4 592.195862 5 0xef0000b8 0xd21cf605 0x0 0
R 4 592.195865 5 0xef0000b8 0x521cf605 0x0 0
W 4 592.195868 5 0xef0000b8 0xd21cef02 0x0 0
R 4 592.195871 5 0xef0000b8 0x521cef02 0x0 0
W 4 592.195873 5 0xef0000b8 0xd21c1f11 0x0 0
R 4 592.195877 5 0xef0000b8 0x521c1f11 0x0 0
W 4 592.195879 5 0xef0000b8 0xd21c0d42 0x0 0
R 4 592.195882 5 0xef0000b8 0x521c0d42 0x0 0
W 4 592.195885 5 0xef0000b8 0xd21cbf88 0x0 0
R 4 592.195888 5 0xef0000b8 0x521cbf88 0x0 0
W 4 592.195891 5 0xef0000b8 0xd21c4b02 0x0 0
R 4 592.195894 5 0xef0000b8 0x521c4b02 0x0 0
W 4 592.195896 5 0xef0000b8 0xd21c6e7d 0x0 0
R 4 592.195900 5 0xef0000b8 0x521c6e7d 0x0 0
W 4 592.195902 5 0xef0000b8 0xd21cef02 0x0 0
R 4 592.195905 5 0xef0000b8 0x521cef02 0x0 0
W 4 592.195908 5 0xef0000b8 0xd21c1b03 0x0 0
R 4 592.195911 5 0xef0000b8 0x521c1b03 0x0 0
W 4 592.195914 5 0xef0000b8 0xd21c1f11 0x0 0
R 4 592.195917 5 0xef0000b8 0x521c1f11 0x0 0
W 4 592.195919 5 0xef0000b8 0xd21c0d42 0x0 0
R 4 592.195923 5 0xef0000b8 0x521c0d42 0x0 0
W 4 592.195925 5 0xef0000b8 0xd21cbf88 0x0 0
R 4 592.195928 5 0xef0000b8 0x521cbf88 0x0 0
W 4 592.195931 5 0xef0000b8 0xd21c4e02 0x0 0
R 4 592.195934 5 0xef0000b8 0x521c4e02 0x0 0
W 4 592.195937 5 0xef0000b8 0xd21c6e7d 0x0 0
R 4 592.195940 5 0xef0000b8 0x521c6e7d 0x0 0
W 4 592.195943 5 0xef0000b8 0xd21cef02 0x0 0
R 4 592.195946 5 0xef0000b8 0x521cef02 0x0 0
W 4 592.195948 5 0xef0000b8 0xd21c1a03 0x0 0
R 4 592.195952 5 0xef0000b8 0x521c1a03 0x0 0
W 4 592.195954 5 0xef0000b8 0xd21c1f11 0x0 0
R 4 592.195957 5 0xef0000b8 0x521c1f11 0x0 0
W 4 592.195960 5 0xef0000b8 0xd21c0d42 0x0 0
R 4 592.195963 5 0xef0000b8 0x521c0d42 0x0 0
W 4 592.195965 5 0xef0000b8 0xd21cbf88 0x0 0
R 4 592.195969 5 0xef0000b8 0x521cbf88 0x0 0
W 4 592.195971 5 0xef0000b8 0xd21c5102 0x0 0
R 4 592.195975 5 0xef0000b8 0x521c5102 0x0 0
W 4 592.195977 5 0xef0000b8 0xd21c6e7d 0x0 0
R 4 592.195980 5 0xef0000b8 0x521c6e7d 0x0 0
W 4 592.195983 5 0xef0000b8 0xd21cef56 0x0 0
R 4 592.195986 5 0xef0000b8 0x521cef56 0x0 0
W 4 592.195988 5 0xef0000b8 0xd21cd020 0x0 0
R 4 592.195992 5 0xef0000b8 0x521cd020 0x0 0
W 4 592.195994 5 0xef0000b8 0xd21c1f11 0x0 0
R 4 592.195998 5 0xef0000b8 0x521c1f11 0x0 0
W 4 592.196000 5 0xef0000b8 0xd21cbf88 0x0 0
R 4 592.196004 5 0xef0000b8 0x521cbf88 0x0 0
W 4 592.196006 5 0xef0000b8 0xd21c5402 0x0 0
R 4 592.196009 5 0xef0000b8 0x521c5402 0x0 0
W 4 592.196012 5 0xef0000b8 0xd21c6e7d 0x0 0
R 4 592.196015 5 0xef0000b8 0x521c6e7d 0x0 0
W 4 592.196017 5 0xef0000b8 0xd21cbf88 0x0 0
R 4 592.196021 5 0xef0000b8 0x521cbf88 0x0 0
W 4 592.196023 5 0xef0000b8 0xd21c5702 0x0 0
R 4 592.196027 5 0xef0000b8 0x521c5702 0x0 0
W 4 592.196029 5 0xef0000b8 0xd21c6e7d 0x0 0
R 4 592.196032 5 0xef0000b8 0x521c6e7d 0x0 0
W 4 592.196035 5 0xef0000b8 0xd21cbf88 0x0 0
R 4 592.196038 5 0xef0000b8 0x521cbf88 0x0 0
W 4 592.196040 5 0xef0000b8 0xd21c5a02 0x0 0
R 4 592.196044 5 0xef0000b8 0x521c5a02 0x0 0
W 4 592.196046 5 0xef0000b8 0xd21c6e7d 0x0 0
R 4 592.196050 5 0xef0000b8 0x521c6e7d 0x0 0
W 4 592.196052 5 0xef0000b8 0xd21ce185 0x0 0
R 4 592.196055 5 0xef0000b8 0x521ce185 0x0 0
W 4 592.196058 5 0xef0000b8 0xd21ca0ef 0x0 0
R 4 592.196061 5 0xef0000b8 0x521ca0ef 0x0 0
W 4 592.196063 5 0xef0000b8 0xd21c0348 0x0 0
R 4 592.196067 5 0xef0000b8 0x521c0348 0x0 0
W 4 592.196069 5 0xef0000b8 0xd21c0a28 0x0 0
R 4 592.196073 5 0xef0000b8 0x521c0a28 0x0 0
W 4 592.196075 5 0xef0000b8 0xd21c05ef 0x0 0
R 4 592.196078 5 0xef0000b8 0x521c05ef 0x0 0
W 4 592.196081 5 0xef0000b8 0xd21c201b 0x0 0
R 4 592.196084 5 0xef0000b8 0x521c201b 0x0 0
W 4 592.196086 5 0xef0000b8 0xd21c01ad 0x0 0
R 4 592.196090 5 0xef0000b8 0x521c01ad 0x0 0
W 4 592.196092 5 0xef0000b8 0xd21c2735 0x0 0
R 4 592.196096 5 0xef0000b8 0x521c2735 0x0 0
W 4 592.196098 5 0xef0000b8 0xd21c1f44 0x0 0
R 4 592.196101 5 0xef0000b8 0x521c1f44 0x0 0
W 4 592.196104 5 0xef0000b8 0xd21ce085 0x0 0
R 4 592.196107 5 0xef0000b8 0x521ce085 0x0 0
W 4 592.196109 5 0xef0000b8 0xd21c88e1 0x0 0
R 4 592.196113 5 0xef0000b8 0x521c88e1 0x0 0
W 4 592.196115 5 0xef0000b8 0xd21c8589 0x0 0
R 4 592.196119 5 0xef0000b8 0x521c8589 0x0 0
W 4 592.196121 5 0xef0000b8 0xd21cbf88 0x0 0
R 4 592.196124 5 0xef0000b8 0x521cbf88 0x0 0
W 4 592.196127 5 0xef0000b8 0xd21c5d02 0x0 0
R 4 592.196130 5 0xef0000b8 0x521c5d02 0x0 0
W 4 592.196132 5 0xef0000b8 0xd21c6e7d 0x0 0
R 4 592.196136 5 0xef0000b8 0x521c6e7d 0x0 0
W 4 592.196138 5 0xef0000b8 0xd21ce085 0x0 0
R 4 592.196142 5 0xef0000b8 0x521ce085 0x0 0
W 4 592.196144 5 0xef0000b8 0xd21c8ee1 0x0 0
R 4 592.196147 5 0xef0000b8 0x521c8ee1 0x0 0
W 4 592.196150 5 0xef0000b8 0xd21c858f 0x0 0
R 4 592.196153 5 0xef0000b8 0x521c858f 0x0 0
W 4 592.196155 5 0xef0000b8 0xd21cbf88 0x0 0
R 4 592.196159 5 0xef0000b8 0x521cbf88 0x0 0
W 4 592.196161 5 0xef0000b8 0xd21c6002 0x0 0
R 4 592.196165 5 0xef0000b8 0x521c6002 0x0 0
W 4 592.196167 5 0xef0000b8 0xd21c6e7d 0x0 0
R 4 592.196170 5 0xef0000b8 0x521c6e7d 0x0 0
W 4 592.196173 5 0xef0000b8 0xd21ce085 0x0 0
R 4 592.196176 5 0xef0000b8 0x521ce085 0x0 0
W 4 592.196178 5 0xef0000b8 0xd21c94e1 0x0 0
R 4 592.196182 5 0xef0000b8 0x521c94e1 0x0 0
W 4 592.196184 5 0xef0000b8 0xd21c8595 0x0 0
R 4 592.196188 5 0xef0000b8 0x521c8595 0x0 0
W 4 592.196190 5 0xef0000b8 0xd21cbf88 0x0 0
R 4 592.196193 5 0xef0000b8 0x521cbf88 0x0 0
W 4 592.196196 5 0xef0000b8 0xd21c6302 0x0 0
R 4 592.196199 5 0xef0000b8 0x521c6302 0x0 0
W 4 592.196202 5 0xef0000b8 0xd21c6e7d 0x0 0
R 4 592.196205 5 0xef0000b8 0x521c6e7d 0x0 0
W 4 592.196207 5 0xef0000b8 0xd21ce085 0x0 0
R 4 592.196211 5 0xef0000b8 0x521ce085 0x0 0
W 4 592.196213 5 0xef0000b8 0xd21c9ae1 0x0 0
R 4 592.196216 5 0xef0000b8 0x521c9ae1 0x0 0
W 4 592.196219 5 0xef0000b8 0xd21c859b 0x0 0
R 4 592.196222 5 0xef0000b8 0x521c859b 0x0 0
W 4 592.196225 5 0xef0000b8 0xd21cbf88 0x0 0
R 4 592.196228 5 0xef0000b8 0x521cbf88 0x0 0
W 4 592.196230 5 0xef0000b8 0xd21c6602 0x0 0
R 4 592.196234 5 0xef0000b8 0x521c6602 0x0 0
W 4 592.196236 5 0xef0000b8 0xd21c6e7d 0x0 0
R 4 592.196239 5 0xef0000b8 0x521c6e7d 0x0 0
W 4 592.196242 5 0xef0000b8 0xd21caf88 0x0 0
R 4 592.196245 5 0xef0000b8 0x521caf88 0x0 0
W 4 592.196248 5 0xef0000b8 0xd21c3cbf 0x0 0
R 4 592.196251 5 0xef0000b8 0x521c3cbf 0x0 0
W 4 592.196253 5 0xef0000b8 0xd21c883f 0x0 0
R 4 592.196257 5 0xef0000b8 0x521c883f 0x0 0
W 4 592.196259 5 0xef0000b8 0xd21c026e 0x0 0
R 4 592.196262 5 0xef0000b8 0x521c026e 0x0 0
W 4 592.196265 5 0xef0000b8 0xd21c9cad 0x0 0
R 4 592.196268 5 0xef0000b8 0x521c9cad 0x0 0
W 4 592.196271 5 0xef0000b8 0xd21c2835 0x0 0
R 4 592.196274 5 0xef0000b8 0x521c2835 0x0 0
W 4 592.196276 5 0xef0000b8 0xd21c1f44 0x0 0
R 4 592.196280 5 0xef0000b8 0x521c1f44 0x0 0
W 4 592.196282 5 0xef0000b8 0xd21ce08f 0x0 0
R 4 592.196285 5 0xef0000b8 0x521ce08f 0x0 0
W 4 592.196288 5 0xef0000b8 0xd21cf8e1 0x0 0
R 4 592.196291 5 0xef0000b8 0x521cf8e1 0x0 0
W 4 592.196294 5 0xef0000b8 0xd21c8ff9 0x0 0
R 4 592.196297 5 0xef0000b8 0x521c8ff9 0x0 0
W 4 592.196299 5 0xef0000b8 0xd21cbf88 0x0 0
R 4 592.196303 5 0xef0000b8 0x521cbf88 0x0 0
W 4 592.196305 5 0xef0000b8 0xd21c5d02 0x0 0
R 4 592.196308 5 0xef0000b8 0x521c5d02 0x0 0
W 4 592.196311 5 0xef0000b8 0xd21c6e7d 0x0 0
R 4 592.196314 5 0xef0000b8 0x521c6e7d 0x0 0
W 4 592.196317 5 0xef0000b8 0xd21ce08f 0x0 0
R 4 592.196320 5 0xef0000b8 0x521ce08f 0x0 0
W 4 592.196322 5 0xef0000b8 0xd21cfae1 0x0 0
R 4 592.196326 5 0xef0000b8 0x521cfae1 0x0 0
W 4 592.196328 5 0xef0000b8 0xd21c8ffb 0x0 0
R 4 592.196331 5 0xef0000b8 0x521c8ffb 0x0 0
W 4 592.196341 5 0xef0000b8 0xd21cbf88 0x0 0
R 4 592.196344 5 0xef0000b8 0x521cbf88 0x0 0
W 4 592.196347 5 0xef0000b8 0xd21c6002 0x0 0
R 4 592.196350 5 0xef0000b8 0x521c6002 0x0 0
W 4 592.196353 5 0xef0000b8 0xd21c6e7d 0x0 0
R 4 592.196356 5 0xef0000b8 0x521c6e7d 0x0 0
W 4 592.196358 5 0xef0000b8 0xd21ce08f 0x0 0
R 4 592.196362 5 0xef0000b8 0x521ce08f 0x0 0
W 4 592.196364 5 0xef0000b8 0xd21cfce1 0x0 0
R 4 592.196367 5 0xef0000b8 0x521cfce1 0x0 0
W 4 592.196370 5 0xef0000b8 0xd21c8ffd 0x0 0
R 4 592.196373 5 0xef0000b8 0x521c8ffd 0x0 0
W 4 592.196376 5 0xef0000b8 0xd21cbf88 0x0 0
R 4 592.196379 5 0xef0000b8 0x521cbf88 0x0 0
W 4 592.196381 5 0xef0000b8 0xd21c6302 0x0 0
R 4 592.196385 5 0xef0000b8 0x521c6302 0x0 0
W 4 592.196387 5 0xef0000b8 0xd21c6e7d 0x0 0
R 4 592.196390 5 0xef0000b8 0x521c6e7d 0x0 0
W 4 592.196393 5 0xef0000b8 0xd21ce08f 0x0 0
R 4 592.196396 5 0xef0000b8 0x521ce08f 0x0 0
W 4 592.196399 5 0xef0000b8 0xd21cfee1 0x0 0
R 4 592.196402 5 0xef0000b8 0x521cfee1 0x0 0
W 4 592.196404 5 0xef0000b8 0xd21c8fff 0x0 0
R 4 592.196408 5 0xef0000b8 0x521c8fff 0x0 0
W 4 592.196410 5 0xef0000b8 0xd21cbf88 0x0 0
R 4 592.196413 5 0xef0000b8 0x521cbf88 0x0 0
W 4 592.196416 5 0xef0000b8 0xd21c6602 0x0 0
R 4 592.196419 5 0xef0000b8 0x521c6602 0x0 0
W 4 592.196422 5 0xef0000b8 0xd21c6e7d 0x0 0
R 4 592.196425 5 0xef0000b8 0x521c6e7d 0x0 0
W 4 592.196427 5 0xef0000b8 0xd21caf88 0x0 0
R 4 592.196431 5 0xef0000b8 0x521caf88 0x0 0
W 4 592.196433 5 0xef0000b8 0xd21c3ce1 0x0 0
R 4 592.196436 5 0xef0000b8 0x521c3ce1 0x0 0
W 4 592.196439 5 0xef0000b8 0xd21c85a1 0x0 0
R 4 592.196442 5 0xef0000b8 0x521c85a1 0x0 0
W 4 592.196445 5 0xef0000b8 0xd21c1b21 0x0 0
R 4 592.196448 5 0xef0000b8 0x521c1b21 0x0 0
W 4 592.196450 5 0xef0000b8 0xd21cad37 0x0 0
R 4 592.196454 5 0xef0000b8 0x521cad37 0x0 0
W 4 592.196456 5 0xef0000b8 0xd21c341f 0x0 0
R 4 592.196459 5 0xef0000b8 0x521c341f 0x0 0
W 4 592.196462 5 0xef0000b8 0xd21c44e0 0x0 0
R 4 592.196465 5 0xef0000b8 0x521c44e0 0x0 0
W 4 592.196468 5 0xef0000b8 0xd21c858a 0x0 0
R 4 592.196471 5 0xef0000b8 0x521c858a 0x0 0
W 4 592.196473 5 0xef0000b8 0xd21ce185 0x0 0
R 4 592.196477 5 0xef0000b8 0x521ce185 0x0 0
W 4 592.196479 5 0xef0000b8 0xd21c8bbf 0x0 0
R 4 592.196483 5 0xef0000b8 0x521c8bbf 0x0 0
W 4 592.196485 5 0xef0000b8 0xd21c885d 0x0 0
R 4 592.196489 5 0xef0000b8 0x521c885d 0x0 0
W 4 592.196491 5 0xef0000b8 0xd21c026e 0x0 0
R 4 592.196494 5 0xef0000b8 0x521c026e 0x0 0
W 4 592.196497 5 0xef0000b8 0xd21c7de0 0x0 0
R 4 592.196500 5 0xef0000b8 0x521c7de0 0x0 0
W 4 592.196502 5 0xef0000b8 0xd21c8590 0x0 0
R 4 592.196506 5 0xef0000b8 0x521c8590 0x0 0
W 4 592.196508 5 0xef0000b8 0xd21ce185 0x0 0
R 4 592.196512 5 0xef0000b8 0x521ce185 0x0 0
W 4 592.196514 5 0xef0000b8 0xd21c91bf 0x0 0
R 4 592.196517 5 0xef0000b8 0x521c91bf 0x0 0
W 4 592.196520 5 0xef0000b8 0xd21c8860 0x0 0
R 4 592.196523 5 0xef0000b8 0x521c8860 0x0 0
W 4 592.196525 5 0xef0000b8 0xd21c026e 0x0 0
R 4 592.196529 5 0xef0000b8 0x521c026e 0x0 0
W 4 592.196531 5 0xef0000b8 0xd21c7de0 0x0 0
R 4 592.196535 5 0xef0000b8 0x521c7de0 0x0 0
W 4 592.196537 5 0xef0000b8 0xd21c8596 0x0 0
R 4 592.196540 5 0xef0000b8 0x521c8596 0x0 0
W 4 592.196543 5 0xef0000b8 0xd21ce185 0x0 0
R 4 592.196546 5 0xef0000b8 0x521ce185 0x0 0
W 4 592.196548 5 0xef0000b8 0xd21c97bf 0x0 0
R 4 592.196552 5 0xef0000b8 0x521c97bf 0x0 0
W 4 592.196554 5 0xef0000b8 0xd21c8863 0x0 0
R 4 592.196558 5 0xef0000b8 0x521c8863 0x0 0
W 4 592.196560 5 0xef0000b8 0xd21c026e 0x0 0
R 4 592.196563 5 0xef0000b8 0x521c026e 0x0 0
W 4 592.196566 5 0xef0000b8 0xd21c7de0 0x0 0
R 4 592.196569 5 0xef0000b8 0x521c7de0 0x0 0
W 4 592.196571 5 0xef0000b8 0xd21c859c 0x0 0
R 4 592.196575 5 0xef0000b8 0x521c859c 0x0 0
W 4 592.196577 5 0xef0000b8 0xd21ce185 0x0 0
R 4 592.196581 5 0xef0000b8 0x521ce185 0x0 0
W 4 592.196583 5 0xef0000b8 0xd21c9dbf 0x0 0
R 4 592.196586 5 0xef0000b8 0x521c9dbf 0x0 0
W 4 592.196589 5 0xef0000b8 0xd21c8866 0x0 0
R 4 592.196592 5 0xef0000b8 0x521c8866 0x0 0
W 4 592.196594 5 0xef0000b8 0xd21c026e 0x0 0
R 4 592.196598 5 0xef0000b8 0x521c026e 0x0 0
W 4 592.196600 5 0xef0000b8 0xd21c7dae 0x0 0
R 4 592.196604 5 0xef0000b8 0x521c7dae 0x0 0
W 4 592.196606 5 0xef0000b8 0xd21c401f 0x0 0
R 4 592.196609 5 0xef0000b8 0x521c401f 0x0 0
W 4 592.196612 5 0xef0000b8 0xd21c44e0 0x0 0
R 4 592.196615 5 0xef0000b8 0x521c44e0 0x0 0
W 4 592.196617 5 0xef0000b8 0xd21c858c 0x0 0
R 4 592.196621 5 0xef0000b8 0x521c858c 0x0 0
W 4 592.196623 5 0xef0000b8 0xd21ce185 0x0 0
R 4 592.196627 5 0xef0000b8 0x521ce185 0x0 0
W 4 592.196629 5 0xef0000b8 0xd21c8dbf 0x0 0
R 4 592.196632 5 0xef0000b8 0x521c8dbf 0x0 0
W 4 592.196635 5 0xef0000b8 0xd21c885d 0x0 0
R 4 592.196638 5 0xef0000b8 0x521c885d 0x0 0
W 4 592.196640 5 0xef0000b8 0xd21c026e 0x0 0
R 4 592.196644 5 0xef0000b8 0x521c026e 0x0 0
W 4 592.196646 5 0xef0000b8 0xd21c7de0 0x0 0
R 4 592.196650 5 0xef0000b8 0x521c7de0 0x0 0
W 4 592.196652 5 0xef0000b8 0xd21c8592 0x0 0
R 4 592.196655 5 0xef0000b8 0x521c8592 0x0 0
W 4 592.196658 5 0xef0000b8 0xd21ce185 0x0 0
R 4 592.196661 5 0xef0000b8 0x521ce185 0x0 0
W 4 592.196663 5 0xef0000b8 0xd21c93bf 0x0 0
R 4 592.196667 5 0xef0000b8 0x521c93bf 0x0 0
W 4 592.196669 5 0xef0000b8 0xd21c8860 0x0 0
R 4 592.196673 5 0xef0000b8 0x521c8860 0x0 0
W 4 592.196675 5 0xef0000b8 0xd21c026e 0x0 0
R 4 592.196678 5 0xef0000b8 0x521c026e 0x0 0
W 4 592.196681 5 0xef0000b8 0xd21c7de0 0x0 0
R 4 592.196684 5 0xef0000b8 0x521c7de0 0x0 0
W 4 592.196686 5 0xef0000b8 0xd21c8598 0x0 0
R 4 592.196690 5 0xef0000b8 0x521c8598 0x0 0
W 4 592.196692 5 0xef0000b8 0xd21ce185 0x0 0
R 4 592.196696 5 0xef0000b8 0x521ce185 0x0 0
W 4 592.196698 5 0xef0000b8 0xd21c99bf 0x0 0
R 4 592.196701 5 0xef0000b8 0x521c99bf 0x0 0
W 4 592.196704 5 0xef0000b8 0xd21c8863 0x0 0
R 4 592.196707 5 0xef0000b8 0x521c8863 0x0 0
W 4 592.196709 5 0xef0000b8 0xd21c026e 0x0 0
R 4 592.196713 5 0xef0000b8 0x521c026e 0x0 0
W 4 592.196715 5 0xef0000b8 0xd21c7de0 0x0 0
R 4 592.196719 5 0xef0000b8 0x521c7de0 0x0 0
W 4 592.196721 5 0xef0000b8 0xd21c859e 0x0 0
R 4 592.196724 5 0xef0000b8 0x521c859e 0x0 0
W 4 592.196727 5 0xef0000b8 0xd21ce185 0x0 0
R 4 592.196730 5 0xef0000b8 0x521ce185 0x0 0
W 4 592.196732 5 0xef0000b8 0xd21c9fbf 0x0 0
R 4 592.196736 5 0xef0000b8 0x521c9fbf 0x0 0
W 4 592.196738 5 0xef0000b8 0xd21c8866 0x0 0
R 4 592.196742 5 0xef0000b8 0x521c8866 0x0 0
W 4 592.196744 5 0xef0000b8 0xd21c026e 0x0 0
R 4 592.196747 5 0xef0000b8 0x521c026e 0x0 0
W 4 592.196750 5 0xef0000b8 0xd21c7dae 0x0 0
R 4 592.196753 5 0xef0000b8 0x521c7dae 0x0 0
W 4 592.196755 5 0xef0000b8 0xd21c0ce1 0x0 0
R 4 592.196759 5 0xef0000b8 0x521c0ce1 0x0 0
W 4 592.196761 5 0xef0000b8 0xd21c85b3 0x0 0
R 4 592.196765 5 0xef0000b8 0x521c85b3 0x0 0
W 4 592.196767 5 0xef0000b8 0xd21c3904 0x0 0
R 4 592.196770 5 0xef0000b8 0x521c3904 0x0 0
W 4 592.196773 5 0xef0000b8 0xd21cac2f 0x0 0
R 4 592.196776 5 0xef0000b8 0x521cac2f 0x0 0
W 4 592.196779 5 0xef0000b8 0xd21c04ee 0x0 0
R 4 592.196782 5 0xef0000b8 0x521c04ee 0x0 0
W 4 592.196784 5 0xef0000b8 0xd21c85b3 0x0 0
R 4 592.196788 5 0xef0000b8 0x521c85b3 0x0 0
W 4 592.196790 5 0xef0000b8 0xd21c00af 0x0 0
R 4 592.196794 5 0xef0000b8 0x521c00af 0x0 0
W 4 592.196796 5 0xef0000b8 0xd21c39d9 0x0 0
R 4 592.196799 5 0xef0000b8 0x521c39d9 0x0 0
W 4 592.196802 5 0xef0000b8 0xd21c22ac 0x0 0
R 4 592.196805 5 0xef0000b8 0x521c22ac 0x0 0
W 4 592.196807 5 0xef0000b8 0xd21ceaf0 0x0 0
R 4 592.196811 5 0xef0000b8 0x521ceaf0 0x0 0
W 4 592.196813 5 0xef0000b8 0xd21cacf6 0x0 0
R 4 592.196817 5 0xef0000b8 0x521cacf6 0x0 0
W 4 592.196819 5 0xef0000b8 0xd21cf0ac 0x0 0
R 4 592.196822 5 0xef0000b8 0x521cf0ac 0x0 0
W 4 592.196825 5 0xef0000b8 0xd21cfaf0 0x0 0
R 4 592.196828 5 0xef0000b8 0x521cfaf0 0x0 0
W 4 592.196830 5 0xef0000b8 0xd21cacf8 0x0 0
R 4 592.196834 5 0xef0000b8 0x521cacf8 0x0 0
W 4 592.196836 5 0xef0000b8 0xd21cf0ac 0x0 0
R 4 592.196840 5 0xef0000b8 0x521cf0ac 0x0 0
W 4 592.196842 5 0xef0000b8 0xd21cfcf0 0x0 0
R 4 592.196845 5 0xef0000b8 0x521cfcf0 0x0 0
W 4 592.196848 5 0xef0000b8 0xd21cad00 0x0 0
R 4 592.196851 5 0xef0000b8 0x521cad00 0x0 0
W 4 592.196853 5 0xef0000b8 0xd21cf0ac 0x0 0
R 4 592.196857 5 0xef0000b8 0x521cf0ac 0x0 0
W 4 592.196859 5 0xef0000b8 0xd21cfef0 0x0 0
R 4 592.196863 5 0xef0000b8 0x521cfef0 0x0 0
W 4 592.196865 5 0xef0000b8 0xd21cacf0 0x0 0
R 4 592.196868 5 0xef0000b8 0x521cacf0 0x0 0
W 4 592.196871 5 0xef0000b8 0xd21cf0ac 0x0 0
R 4 592.196874 5 0xef0000b8 0x521cf0ac 0x0 0
W 4 592.196876 5 0xef0000b8 0xd21cf4f0 0x0 0
R 4 592.196880 5 0xef0000b8 0x521cf4f0 0x0 0
W 4 592.196882 5 0xef0000b8 0xd21cacf2 0x0 0
R 4 592.196886 5 0xef0000b8 0x521cacf2 0x0 0
W 4 592.196888 5 0xef0000b8 0xd21cf0ac 0x0 0
R 4 592.196891 5 0xef0000b8 0x521cf0ac 0x0 0
W 4 592.196894 5 0xef0000b8 0xd21cb0f0 0x0 0
R 4 592.196897 5 0xef0000b8 0x521cb0f0 0x0 0
W 4 592.196899 5 0xef0000b8 0xd21cacae 0x0 0
R 4 592.196903 5 0xef0000b8 0x521cacae 0x0 0
W 4 592.196905 5 0xef0000b8 0xd21cf0ac 0x0 0
R 4 592.196909 5 0xef0000b8 0x521cf0ac 0x0 0
W 4 592.196911 5 0xef0000b8 0xd21cacf0 0x0 0
R 4 592.196914 5 0xef0000b8 0x521cacf0 0x0 0
W 4 592.196917 5 0xef0000b8 0xd21cacaa 0x0 0
R 4 592.196920 5 0xef0000b8 0x521cacaa 0x0 0
W 4 592.196922 5 0xef0000b8 0xd21ca100 0x0 0
R 4 592.196926 5 0xef0000b8 0x521ca100 0x0 0
W 4 592.196928 5 0xef0000b8 0xd21c0ce1 0x0 0
R 4 592.196932 5 0xef0000b8 0x521c0ce1 0x0 0
W 4 592.196934 5 0xef0000b8 0xd21c8ff7 0x0 0
R 4 592.196937 5 0xef0000b8 0x521c8ff7 0x0 0
W 4 592.196940 5 0xef0000b8 0xd21cbf88 0x0 0
R 4 592.196943 5 0xef0000b8 0x521cbf88 0x0 0
W 4 592.196945 5 0xef0000b8 0xd21c8402 0x0 0
R 4 592.196949 5 0xef0000b8 0x521c8402 0x0 0
W 4 592.196951 5 0xef0000b8 0xd21c6e7d 0x0 0
R 4 592.196955 5 0xef0000b8 0x521c6e7d 0x0 0
W 4 592.196957 5 0xef0000b8 0xd21caf26 0x0 0
R 4 592.196960 5 0xef0000b8 0x521caf26 0x0 0
W 4 592.196963 5 0xef0000b8 0xd21ce9e1 0x0 0
R 4 592.196966 5 0xef0000b8 0x521ce9e1 0x0 0
W 4 592.196968 5 0xef0000b8 0xd21c8ff6 0x0 0
R 4 592.196972 5 0xef0000b8 0x521c8ff6 0x0 0
W 4 592.196974 5 0xef0000b8 0xd21cbf88 0x0 0
R 4 592.196978 5 0xef0000b8 0x521cbf88 0x0 0
W 4 592.196980 5 0xef0000b8 0xd21c8402 0x0 0
R 4 592.196983 5 0xef0000b8 0x521c8402 0x0 0
W 4 592.196986 5 0xef0000b8 0xd21c6e7d 0x0 0
R 4 592.196989 5 0xef0000b8 0x521c6e7d 0x0 0
W 4 592.196991 5 0xef0000b8 0xd21caf26 0x0 0
R 4 592.196995 5 0xef0000b8 0x521caf26 0x0 0
W 4 592.196997 5 0xef0000b8 0xd21cf520 0x0 0
R 4 592.197001 5 0xef0000b8 0x521cf520 0x0 0
W 4 592.197003 5 0xef0000b8 0xd21cac86 0x0 0
R 4 592.197006 5 0xef0000b8 0x521cac86 0x0 0
W 4 592.197009 5 0xef0000b8 0xd21cbf88 0x0 0
R 4 592.197012 5 0xef0000b8 0x521cbf88 0x0 0
W 4 592.197015 5 0xef0000b8 0xd21c3f02 0x0 0
R 4 592.197018 5 0xef0000b8 0x521c3f02 0x0 0
W 4 592.197020 5 0xef0000b8 0xd21c6e9c 0x0 0
R 4 592.197024 5 0xef0000b8 0x521c6e9c 0x0 0
W 4 592.197026 5 0xef0000b8 0xd21cad28 0x0 0
R 4 592.197029 5 0xef0000b8 0x521cad28 0x0 0
W 4 592.197032 5 0xef0000b8 0xd21c03af 0x0 0
R 4 592.197035 5 0xef0000b8 0x521c03af 0x0 0
W 4 592.197038 5 0xef0000b8 0xd21c3324 0x0 0
R 4 592.197041 5 0xef0000b8 0x521c3324 0x0 0
W 4 592.197043 5 0xef0000b8 0xd21cad38 0x0 0
R 4 592.197047 5 0xef0000b8 0x521cad38 0x0 0
W 4 592.197049 5 0xef0000b8 0xd21c03af 0x0 0
R 4 592.197052 5 0xef0000b8 0x521c03af 0x0 0
W 4 592.197055 5 0xef0000b8 0xd21c32e6 0x0 0
R 4 592.197058 5 0xef0000b8 0x521c32e6 0x0 0
W 4 592.197061 5 0xef0000b8 0xd21caf32 0x0 0
R 4 592.197064 5 0xef0000b8 0x521caf32 0x0 0
W 4 592.197066 5 0xef0000b8 0xd21cfb00 0x0 0
R 4 592.197070 5 0xef0000b8 0x521cfb00 0x0 0
W 4 592.197072 5 0xef0000b8 0xd21bb87c 0x0 0
R 4 592.197075 5 0xef0000b8 0x521bb87c 0x0 0
W 4 592.197078 5 0xef0000b8 0xd21c8ff6 0x0 0
R 4 592.197081 5 0xef0000b8 0x521c8ff6 0x0 0
W 4 592.197084 5 0xef0000b8 0xd21bb87e 0x0 0
R 4 592.197087 5 0xef0000b8 0x521bb87e 0x0 0
W 4 592.197089 5 0xef0000b8 0xd21c0705 0x0 0
R 4 592.197093 5 0xef0000b8 0x521c0705 0x0 0
W 4 592.197095 5 0xef0000b8 0xd21bb87c 0x0 0
R 4 592.197098 5 0xef0000b8 0x521bb87c 0x0 0
W 4 592.197101 5 0xef0000b8 0xd21c8ff8 0x0 0
R 4 592.197104 5 0xef0000b8 0x521c8ff8 0x0 0
W 4 592.197107 5 0xef0000b8 0xd21bb87e 0x0 0
R 4 592.197110 5 0xef0000b8 0x521bb87e 0x0 0
W 4 592.197112 5 0xef0000b8 0xd21c19cc 0x0 0
R 4 592.197116 5 0xef0000b8 0x521c19cc 0x0 0
W 4 592.197118 5 0xef0000b8 0xd21bb87c 0x0 0
R 4 592.197121 5 0xef0000b8 0x521bb87c 0x0 0
W 4 592.197124 5 0xef0000b8 0xd21c8ffa 0x0 0
R 4 592.197127 5 0xef0000b8 0x521c8ffa 0x0 0
W 4 592.197129 5 0xef0000b8 0xd21bb87e 0x0 0
R 4 592.197133 5 0xef0000b8 0x521bb87e 0x0 0
W 4 592.197135 5 0xef0000b8 0xd21c28e3 0x0 0
R 4 592.197139 5 0xef0000b8 0x521c28e3 0x0 0
W 4 592.197141 5 0xef0000b8 0xd21bb87c 0x0 0
R 4 592.197144 5 0xef0000b8 0x521bb87c 0x0 0
W 4 592.197147 5 0xef0000b8 0xd21c8ffc 0x0 0
R 4 592.197150 5 0xef0000b8 0x521c8ffc 0x0 0
W 4 592.197152 5 0xef0000b8 0xd21bb87e 0x0 0
R 4 592.197156 5 0xef0000b8 0x521bb87e 0x0 0
W 4 592.197158 5 0xef0000b8 0xd21c1047 0x0 0
R 4 592.197162 5 0xef0000b8 0x521c1047 0x0 0
W 4 592.197164 5 0xef0000b8 0xd21bb87c 0x0 0
R 4 592.197180 5 0xef0000b8 0x521bb87c 0x0 0
W 4 592.197183 5 0xef0000b8 0xd21c8ffe 0x0 0
R 4 592.197186 5 0xef0000b8 0x521c8ffe 0x0 0
W 4 592.197189 5 0xef0000b8 0xd21bb87e 0x0 0
R 4 592.197193 5 0xef0000b8 0x521bb87e 0x0 0
W 4 592.197195 5 0xef0000b8 0xd21c0a45 0x0 0
R 4 592.197199 5 0xef0000b8 0x521c0a45 0x0 0
W 4 592.197202 5 0xef0000b8 0xd21bb85e 0x0 0
R 4 592.197205 5 0xef0000b8 0x521bb85e 0x0 0
W 4 592.197208 5 0xef0000b8 0xd21c271e 0x0 0
R 4 592.197212 5 0xef0000b8 0x521c271e 0x0 0
W 4 592.197214 5 0xef0000b8 0xd21bb860 0x0 0
R 4 592.197218 5 0xef0000b8 0x521bb860 0x0 0
W 4 592.197221 5 0xef0000b8 0xd21c3846 0x0 0
R 4 592.197224 5 0xef0000b8 0x521c3846 0x0 0
W 4 592.197227 5 0xef0000b8 0xd21bb862 0x0 0
R 4 592.197231 5 0xef0000b8 0x521bb862 0x0 0
W 4 592.197233 5 0xef0000b8 0xd21c26e6 0x0 0
R 4 592.197237 5 0xef0000b8 0x521c26e6 0x0 0
W 4 592.197240 5 0xef0000b8 0xd21bb864 0x0 0
R 4 592.197243 5 0xef0000b8 0x521bb864 0x0 0
W 4 592.197246 5 0xef0000b8 0xd21c32e3 0x0 0
R 4 592.197250 5 0xef0000b8 0x521c32e3 0x0 0
W 4 592.197252 5 0xef0000b8 0xd21bb886 0x0 0
R 4 592.197256 5 0xef0000b8 0x521bb886 0x0 0
W 4 592.197259 5 0xef0000b8 0xd21cffff 0x0 0
R 4 592.197262 5 0xef0000b8 0x521cffff 0x0 0
W 4 592.197265 5 0xef0000b8 0xd21bb888 0x0 0
R 4 592.197269 5 0xef0000b8 0x521bb888 0x0 0
W 4 592.197271 5 0xef0000b8 0xd21cffff 0x0 0
R 4 592.197275 5 0xef0000b8 0x521cffff 0x0 0
W 4 592.197278 5 0xef0000b8 0xd21bb88a 0x0 0
R 4 592.197281 5 0xef0000b8 0x521bb88a 0x0 0
W 4 592.197284 5 0xef0000b8 0xd21cffff 0x0 0
R 4 592.197288 5 0xef0000b8 0x521cffff 0x0 0
W 4 592.197290 5 0xef0000b8 0xd21bb88c 0x0 0
R 4 592.197294 5 0xef0000b8 0x521bb88c 0x0 0
W 4 592.197297 5 0xef0000b8 0xd21cffff 0x0 0
R 4 592.197301 5 0xef0000b8 0x521cffff 0x0 0
W 4 592.197303 5 0xef0000b8 0xd21bb838 0x0 0
R 4 592.197307 5 0xef0000b8 0x521bb838 0x0 0
W 4 592.197309 5 0xef0000b8 0xd21c000f 0x0 0
R 4 592.197313 5 0xef0000b8 0x521c000f 0x0 0
W 4 592.197316 5 0xef0000b8 0xdc100010 0x0 0
R 4 592.197319 5 0xef0000b8 0x5c100010 0x0 0
W 4 592.197322 5 0xef0000b8 0xd21b0000 0x0 0
R 4 592.197326 5 0xef0000b8 0x521b0000 0x0 0
W 4 592.197328 5 0xef0000b8 0xd21c0000 0x0 0
R 4 592.197332 5 0xef0000b8 0x521c0000 0x0 0
W 4 592.197337 5 0xef0000b8 0xd21bb82e 0x0 0
R 4 592.197341 5 0xef0000b8 0x521bb82e 0x0 0
W 4 592.197343 5 0xef0000b8 0xd21c0000 0x0 0
R 4 592.197347 5 0xef0000b8 0x521c0000 0x0 0
W 4 592.197350 5 0xef0000b8 0xd21b8024 0x0 0
R 4 592.197353 5 0xef0000b8 0x521b8024 0x0 0
W 4 592.197356 5 0xef0000b8 0xd21c0000 0x0 0
R 4 592.197360 5 0xef0000b8 0x521c0000 0x0 0
W 4 592.197362 5 0xef0000b8 0xdc100000 0x0 0
R 4 592.197366 5 0xef0000b8 0x5c100000 0x0 0
W 4 592.197369 5 0xef0000b8 0xd21b801e 0x0 0
R 4 592.197373 5 0xef0000b8 0x521b801e 0x0 0
W 4 592.197375 5 0xef0000b8 0xd21c0016 0x0 0
R 4 592.197379 5 0xef0000b8 0x521c0016 0x0 0
W 4 592.197382 5 0xef0000b8 0x5c100000 0x0 0
R 4 592.197385 5 0xef0000b8 0xdc100000 0x0 0
R 4 592.197389 5 0xef0000b8 0xdc100000 0x0 0
W 4 592.197392 5 0xef0000b8 0xdc100000 0x0 0
R 4 592.197395 5 0xef0000b8 0x5c100000 0x0 0
W 4 592.218571 5 0xef0000b8 0x52000000 0x0 0
R 4 592.218586 5 0xef0000b8 0xd2001040 0x0 0
R 4 592.218591 5 0xef0000b8 0xd2001040 0x0 0
W 4 592.218597 5 0xef0000b8 0x52210000 0x0 0
R 4 592.218602 5 0xef0000b8 0xd2210c3c 0x0 0
R 4 592.218607 5 0xef0000b8 0xd2210c3c 0x0 0
W 4 592.218611 5 0xef0000b8 0x56230000 0x0 0
R 4 592.218616 5 0xef0000b8 0xd623b794 0x0 0
R 4 592.218621 5 0xef0000b8 0xd623b794 0x0 0
W 4 592.218625 5 0xef0000b8 0x56980000 0x0 0
R 4 592.218630 5 0xef0000b8 0xd6980a55 0x0 0
R 4 592.218635 5 0xef0000b8 0xd6980a55 0x0 0
W 4 592.218640 5 0xef0000b8 0xdc3e80f5 0x0 0
R 4 592.218645 5 0xef0000b8 0x5c3e80f5 0x0 0
W 4 592.218649 5 0xef0000b8 0xdc3f760e 0x0 0
R 4 592.218654 5 0xef0000b8 0x5c3f760e 0x0 0
W 4 592.218658 5 0xef0000b8 0xdc3e8107 0x0 0
R 4 592.218663 5 0xef0000b8 0x5c3e8107 0x0 0
W 4 592.218667 5 0xef0000b8 0xdc3f360e 0x0 0
R 4 592.218672 5 0xef0000b8 0x5c3f360e 0x0 0
W 4 592.218676 5 0xef0000b8 0xdc3e8551 0x0 0
R 4 592.218681 5 0xef0000b8 0x5c3e8551 0x0 0
W 4 592.218685 5 0xef0000b8 0x5c3f0000 0x0 0
R 4 592.218690 5 0xef0000b8 0xdc3f080e 0x0 0
R 4 592.218695 5 0xef0000b8 0xdc3f080e 0x0 0
W 4 592.218700 5 0xef0000b8 0x5f800000 0x0 0
R 4 592.218705 5 0xef0000b8 0xdf80b202 0x0 0
R 4 592.218710 5 0xef0000b8 0xdf80b202 0x0 0
W 4 592.218714 5 0xef0000b8 0x5fa30000 0x0 0
R 4 592.218719 5 0xef0000b8 0xdfa30300 0x0 0
R 4 592.218724 5 0xef0000b8 0xdfa30300 0x0 0
W 4 592.218728 5 0xef0000b8 0xd21b8044 0x0 0
R 4 592.218733 5 0xef0000b8 0x521b8044 0x0 0
W 4 592.218737 5 0xef0000b8 0x521c0000 0x0 0
R 4 592.218742 5 0xef0000b8 0xd21c2417 0x0 0
R 4 592.218747 5 0xef0000b8 0xd21c2417 0x0 0
W 4 592.218752 5 0xef0000b8 0xd21b804a 0x0 0
R 4 592.218757 5 0xef0000b8 0x521b804a 0x0 0
W 4 592.218761 5 0xef0000b8 0x521c0000 0x0 0
R 4 592.218766 5 0xef0000b8 0xd21c2417 0x0 0
R 4 592.218771 5 0xef0000b8 0xd21c2417 0x0 0
W 4 592.218775 5 0xef0000b8 0xd21b8050 0x0 0
R 4 592.218780 5 0xef0000b8 0x521b8050 0x0 0
W 4 592.218784 5 0xef0000b8 0x521c0000 0x0 0
R 4 592.218789 5 0xef0000b8 0xd21c2417 0x0 0
R 4 592.218794 5 0xef0000b8 0xd21c2417 0x0 0
W 4 592.218798 5 0xef0000b8 0xd21b8056 0x0 0
R 4 592.218803 5 0xef0000b8 0x521b8056 0x0 0
W 4 592.218807 5 0xef0000b8 0x521c0000 0x0 0
R 4 592.218812 5 0xef0000b8 0xd21c2417 0x0 0
R 4 592.218817 5 0xef0000b8 0xd21c2417 0x0 0
W 4 592.218822 5 0xef0000b8 0xd21b805c 0x0 0
R 4 592.218827 5 0xef0000b8 0x521b805c 0x0 0
W 4 592.218831 5 0xef0000b8 0x521c0000 0x0 0
R 4 592.218836 5 0xef0000b8 0xd21c2417 0x0 0
R 4 592.218841 5 0xef0000b8 0xd21c2417 0x0 0
W 4 592.218845 5 0xef0000b8 0xd21b8062 0x0 0
R 4 592.218850 5 0xef0000b8 0x521b8062 0x0 0
W 4 592.218854 5 0xef0000b8 0x521c0000 0x0 0
R 4 592.218860 5 0xef0000b8 0xd21c2417 0x0 0
R 4 592.218865 5 0xef0000b8 0xd21c2417 0x0 0
W 4 592.218869 5 0xef0000b8 0xd21b8068 0x0 0
R 4 592.218874 5 0xef0000b8 0x521b8068 0x0 0
W 4 592.218878 5 0xef0000b8 0x521c0000 0x0 0
R 4 592.218883 5 0xef0000b8 0xd21c2417 0x0 0
R 4 592.218888 5 0xef0000b8 0xd21c2417 0x0 0
W 4 592.218893 5 0xef0000b8 0xd21b806e 0x0 0
R 4 592.218898 5 0xef0000b8 0x521b806e 0x0 0
W 4 592.218902 5 0xef0000b8 0x521c0000 0x0 0
R 4 592.218907 5 0xef0000b8 0xd21c2417 0x0 0
R 4 592.218912 5 0xef0000b8 0xd21c2417 0x0 0
W 4 592.218916 5 0xef0000b8 0xd21b8074 0x0 0
R 4 592.218921 5 0xef0000b8 0x521b8074 0x0 0
W 4 592.218925 5 0xef0000b8 0x521c0000 0x0 0
R 4 592.218930 5 0xef0000b8 0xd21c2417 0x0 0
R 4 592.218935 5 0xef0000b8 0xd21c2417 0x0 0
W 4 592.218940 5 0xef0000b8 0xd21b807a 0x0 0
R 4 592.218945 5 0xef0000b8 0x521b807a 0x0 0
W 4 592.218948 5 0xef0000b8 0x521c0000 0x0 0
R 4 592.218953 5 0xef0000b8 0xd21c2417 0x0 0
R 4 592.218958 5 0xef0000b8 0xd21c2417 0x0 0
W 4 592.218963 5 0xef0000b8 0x52650000 0x0 0
R 4 592.218968 5 0xef0000b8 0xd2656a50 0x0 0
R 4 592.218973 5 0xef0000b8 0xd2656a50 0x0 0
W 4 592.218977 5 0xef0000b8 0x5fc20000 0x0 0
R 4 592.218982 5 0xef0000b8 0xdfc2ac00 0x0 0
R 4 592.218987 5 0xef0000b8 0xdfc2ac00 0x0 0
W 4 592.218992 5 0xef0000b8 0x52da0000 0x0 0
R 4 592.218997 5 0xef0000b8 0xd2da0002 0x0 0
R 4 592.219002 5 0xef0000b8 0xd2da0002 0x0 0
W 4 592.219006 5 0xef0000b8 0x536a0000 0x0 0
R 4 592.219011 5 0xef0000b8 0xd36a0000 0x0 0
R 4 592.219016 5 0xef0000b8 0xd36a0000 0x0 0
W 4 592.219020 5 0xef0000b8 0x536c0000 0x0 0
R 4 592.219025 5 0xef0000b8 0xd36c000c 0x0 0
R 4 592.219030 5 0xef0000b8 0xd36c000c 0x0 0
W 4 592.219035 5 0xef0000b8 0x52140000 0x0 0
R 4 592.219040 5 0xef0000b8 0xd2140000 0x0 0
R 4 592.219045 5 0xef0000b8 0xd2140000 0x0 0
W 4 592.219049 5 0xef0000b8 0x52510000 0x0 0
R 4 592.219054 5 0xef0000b8 0xd2510121 0x0 0
R 4 592.219059 5 0xef0000b8 0xd2510121 0x0 0
W 4 592.219064 5 0xef0000b8 0x52e20000 0x0 0
R 4 592.219069 5 0xef0000b8 0xd2e20006 0x0 0
R 4 592.219074 5 0xef0000b8 0xd2e20006 0x0 0
W 4 592.219079 5 0xef0000b8 0xd2e80006 0x0 0
R 4 592.219084 5 0xef0000b8 0x52e80006 0x0 0
W 4 592.219088 5 0xef0000b8 0x52000000 0x0 0
R 4 592.219093 5 0xef0000b8 0xd2001040 0x0 0
R 4 592.219098 5 0xef0000b8 0xd2001040 0x0 0
W 4 592.219102 5 0xef0000b8 0xd2009240 0x0 0
R 4 592.219107 5 0xef0000b8 0x52009240 0x0 0
W 4 592.269356 5 0xef0000b8 0x52000000 0x0 0
R 4 592.269375 5 0xef0000b8 0xd2001040 0x0 0
R 4 592.269381 5 0xef0000b8 0xd2001040 0x0 0
W 4 592.272601 5 0xef000038 0x0 0x0 0
W 4 592.272618 5 0xef00003c 0xffffffff 0x0 0
R 1 592.272630 5 0xef000037 0x0 0x0 0
R 4 592.272642 5 0xef000044 0x40c20f00 0x0 0
W 4 592.272647 5 0xef000044 0x40c20f00 0x0 0
R 4 592.272662 5 0xef0000f0 0x8003f 0x0 0
W 4 592.272667 5 0xef0000f0 0x8003f 0x0 0
R 1 592.276918 5 0xef000037 0x0 0x0 0
W 1 592.276936 5 0xef000037 0x80 0x0 0
R 1 592.276950 5 0xef0000d3 0x32 0x0 0
R 2 592.276962 5 0xef0000e2 0x103 0x0 0
W 1 592.281182 5 0xef000037 0x10 0x0 0
R 1 592.281207 5 0xef000037 0x0 0x0 0
W 1 592.281215 5 0xef000050 0xc0 0x0 0
W 4 592.281221 5 0xef0000b0 0x70490000 0x0 0
R 4 592.281233 5 0xef0000b0 0x800 0x0 0
W 4 592.281238 5 0xef0000b0 0xf0490800 0x0 0
R 1 592.281251 5 0xef000053 0x3c 0x0 0
W 1 592.281256 5 0xef000053 0x3c 0x0 0
R 1 592.281271 5 0xef000056 0x2 0x0 0
W 1 592.281276 5 0xef000056 0x2 0x0 0
W 2 592.281281 5 0xef0000e0 0x2020 0x0 0
W 4 592.281287 5 0xef000a00 0x0 0x0 0
W 4 592.281292 5 0xef000a04 0x0 0x0 0
W 4 592.281297 5 0xef000a08 0x0 0x0 0
W 4 592.281302 5 0xef000a0c 0x0 0x0 0
W 4 592.281307 5 0xef000a10 0x0 0x0 0
W 4 592.281312 5 0xef000a14 0x0 0x0 0
W 4 592.281317 5 0xef000a18 0x0 0x0 0
W 4 592.281322 5 0xef000a1c 0x0 0x0 0
W 4 592.281327 5 0xef000a20 0x0 0x0 0
W 4 592.281332 5 0xef000a24 0x0 0x0 0
W 4 592.281345 5 0xef000a28 0x0 0x0 0
W 4 592.281350 5 0xef000a2c 0x0 0x0 0
W 4 592.281355 5 0xef000a30 0x0 0x0 0
W 4 592.281360 5 0xef000a34 0x0 0x0 0
W 4 592.281366 5 0xef000a38 0x0 0x0 0
W 4 592.281371 5 0xef000a3c 0x0 0x0 0
W 4 592.281377 5 0xef000a40 0x0 0x0 0
W 4 592.281382 5 0xef000a44 0x0 0x0 0
W 4 592.281387 5 0xef000a48 0x0 0x0 0
W 4 592.281392 5 0xef000a4c 0x0 0x0 0
W 4 592.281397 5 0xef000a50 0x0 0x0 0
W 4 592.281402 5 0xef000a54 0x0 0x0 0
W 4 592.281407 5 0xef000a58 0x0 0x0 0
W 4 592.281412 5 0xef000a5c 0x0 0x0 0
W 4 592.281417 5 0xef000a60 0x0 0x0 0
W 4 592.281422 5 0xef000a64 0x0 0x0 0
W 4 592.281427 5 0xef000a68 0x0 0x0 0
W 4 592.281432 5 0xef000a6c 0x0 0x0 0
W 4 592.281437 5 0xef000a70 0x0 0x0 0
W 4 592.281442 5 0xef000a74 0x0 0x0 0
W 4 592.281447 5 0xef000a78 0x0 0x0 0
W 4 592.281452 5 0xef000a7c 0x0 0x0 0
W 4 592.281457 5 0xef000a80 0x0 0x0 0
W 4 592.281462 5 0xef000a84 0x0 0x0 0
W 4 592.281467 5 0xef000a88 0x0 0x0 0
W 4 592.281472 5 0xef000a8c 0x0 0x0 0
W 4 592.281477 5 0xef000a90 0x0 0x0 0
W 4 592.281482 5 0xef000a94 0x0 0x0 0
W 4 592.281487 5 0xef000a98 0x0 0x0 0
W 4 592.281492 5 0xef000a9c 0x0 0x0 0
W 4 592.281497 5 0xef000aa0 0x0 0x0 0
W 4 592.281502 5 0xef000aa4 0x0 0x0 0
W 4 592.281507 5 0xef000aa8 0x0 0x0 0
W 4 592.281512 5 0xef000aac 0x0 0x0 0
W 4 592.281517 5 0xef000ab0 0x0 0x0 0
W 4 592.281522 5 0xef000ab4 0x0 0x0 0
W 4 592.281527 5 0xef000ab8 0x0 0x0 0
W 4 592.281532 5 0xef000abc 0x0 0x0 0
W 4 592.281537 5 0xef000ac0 0x0 0x0 0
W 4 592.281542 5 0xef000ac4 0x0 0x0 0
W 4 592.281547 5 0xef000ac8 0x0 0x0 0
W 4 592.281552 5 0xef000acc 0x0 0x0 0
W 4 592.281557 5 0xef000ad0 0x0 0x0 0
W 4 592.281562 5 0xef000ad4 0x0 0x0 0
W 4 592.281567 5 0xef000ad8 0x0 0x0 0
W 4 592.281572 5 0xef000adc 0x0 0x0 0
W 4 592.281578 5 0xef000ae0 0x0 0x0 0
W 4 592.281583 5 0xef000ae4 0x0 0x0 0
W 4 592.281588 5 0xef000ae8 0x0 0x0 0
W 4 592.281593 5 0xef000aec 0x0 0x0 0
W 4 592.281598 5 0xef000af0 0x0 0x0 0
W 4 592.281603 5 0xef000af4 0x0 0x0 0
W 4 592.281608 5 0xef000af8 0x0 0x0 0
W 4 592.281613 5 0xef000afc 0x0 0x0 0
W 4 592.281681 5 0xef000080 0xb0000 0x0 0
R 4 592.281697 5 0xef000080 0x800ba908 0x0 0
R 4 592.281709 5 0xef000080 0x800ba908 0x0 0
W 4 592.281714 5 0xef000080 0x800ba908 0x0 0
R 4 592.281730 5 0xef000080 0xba908 0x0 0
W 4 592.281745 5 0xef000080 0x1e0000 0x0 0
R 4 592.281760 5 0xef000080 0x801e20eb 0x0 0
R 4 592.281772 5 0xef000080 0x801e20eb 0x0 0
W 4 592.281777 5 0xef000080 0x801e20eb 0x0 0
R 4 592.281792 5 0xef000080 0x1e20eb 0x0 0
W 4 592.281807 5 0xef000080 0xb0000 0x0 0
R 4 592.281823 5 0xef000080 0x800ba908 0x0 0
R 4 592.281834 5 0xef000080 0x800ba908 0x0 0
W 4 592.281840 5 0xef000080 0x800ba908 0x0 0
R 4 592.281855 5 0xef000080 0xba908 0x0 0
W 4 592.281870 5 0xef000080 0x1e0000 0x0 0
R 4 592.281885 5 0xef000080 0x801e20eb 0x0 0
R 4 592.281897 5 0xef000080 0x801e20eb 0x0 0
W 4 592.281902 5 0xef000080 0x801e20eb 0x0 0
R 4 592.281917 5 0xef000080 0x1e20eb 0x0 0
W 4 592.281933 5 0xef000080 0x20000 0x0 0
R 4 592.281948 5 0xef000080 0x800260e2 0x0 0
R 4 592.281960 5 0xef000080 0x800260e2 0x0 0
W 4 592.281965 5 0xef000080 0x800260e2 0x0 0
R 4 592.281980 5 0xef000080 0x260e2 0x0 0
W 4 592.281995 5 0xef000080 0x20000 0x0 0
R 4 592.282010 5 0xef000080 0x800260e2 0x0 0
R 4 592.282022 5 0xef000080 0x800260e2 0x0 0
W 4 592.282027 5 0xef000080 0x800260e2 0x0 0
R 4 592.282042 5 0xef000080 0x260e2 0x0 0
R 1 592.282064 5 0xef000054 0x60 0x0 0
W 1 592.282069 5 0xef000054 0x60 0x0 0
W 2 592.282075 5 0xef000382 0x221b 0x0 0
W 1 592.282080 5 0xef004500 0x0 0x0 0
W 2 592.282085 5 0xef004800 0x0 0x0 0
W 4 592.282090 5 0xef0000b0 0x6a050000 0x0 0
R 4 592.282106 5 0xef0000b0 0x1020088 0x0 0
W 4 592.282111 5 0xef0000b0 0xea050088 0x0 0
R 1 592.282124 5 0xef000052 0xcf 0x0 0
W 1 592.282129 5 0xef000052 0xcf 0x0 0
W 4 592.282134 5 0xef0000b0 0xe0a0ffff 0x0 0
W 4 592.282139 5 0xef0000b0 0xe0a1ffff 0x0 0
W 4 592.282144 5 0xef0000b0 0x69f10000 0x0 0
R 4 592.282157 5 0xef0000b0 0x3ccf03a9 0x0 0
W 4 592.282162 5 0xef0000b0 0xe9f103a9 0x0 0
W 4 592.282168 5 0xef0000b0 0x69f20000 0x0 0
R 4 592.282179 5 0xef0000b0 0x3ccf0000 0x0 0
W 4 592.282184 5 0xef0000b0 0xe9f20000 0x0 0
W 4 592.282189 5 0xef0000b0 0x74300000 0x0 0
R 4 592.282200 5 0xef0000b0 0x3ccf0080 0x0 0
W 4 592.282206 5 0xef0000b0 0xf4300080 0x0 0
W 4 592.282211 5 0xef0000b0 0x75ac0000 0x0 0
R 4 592.282222 5 0xef0000b0 0x3ccf0000 0x0 0
W 4 592.282227 5 0xef0000b0 0xf5ac0000 0x0 0
W 4 592.282232 5 0xef0000b0 0x730a0000 0x0 0
R 4 592.282243 5 0xef0000b0 0x3ccf02ff 0x0 0
W 4 592.282249 5 0xef0000b0 0xf30a02ff 0x0 0
W 4 592.282254 5 0xef0000b0 0x731f0000 0x0 0
R 4 592.282265 5 0xef0000b0 0x3ccf8000 0x0 0
W 4 592.282270 5 0xef0000b0 0xf31f8000 0x0 0
W 4 592.282275 5 0xef0000b0 0x605a0000 0x0 0
R 4 592.282286 5 0xef0000b0 0x3ccf002d 0x0 0
W 4 592.282292 5 0xef0000b0 0xe05a002d 0x0 0
W 4 592.282297 5 0xef0000b0 0x75b50000 0x0 0
R 4 592.282308 5 0xef0000b0 0x3ccf8033 0x0 0
W 4 592.282313 5 0xef0000b0 0xf5b58033 0x0 0
W 4 592.282318 5 0xef0000b0 0x75a80000 0x0 0
R 4 592.282330 5 0xef0000b0 0x3ccf0042 0x0 0
W 4 592.282335 5 0xef0000b0 0xf5a80042 0x0 0
W 4 592.282345 5 0xef0000b0 0x702b0000 0x0 0
R 4 592.282356 5 0xef0000b0 0x3ccf0030 0x0 0
W 4 592.282361 5 0xef0000b0 0xf02b0030 0x0 0
W 4 592.282366 5 0xef0000b0 0x70200000 0x0 0
R 4 592.282377 5 0xef0000b0 0x3ccf6f03 0x0 0
W 4 592.282382 5 0xef0000b0 0xf0206f03 0x0 0
W 4 592.282388 5 0xef0000b0 0x750e0000 0x0 0
R 4 592.282399 5 0xef0000b0 0x3ccf00f1 0x0 0
W 4 592.282404 5 0xef0000b0 0xf50e00f1 0x0 0
W 4 592.282409 5 0xef0000b0 0x70600000 0x0 0
R 4 592.282420 5 0xef0000b0 0x3ccf4403 0x0 0
W 4 592.282425 5 0xef0000b0 0xf0604403 0x0 0
W 4 592.282430 5 0xef0000b0 0x70290000 0x0 0
R 4 592.282442 5 0xef0000b0 0x3ccf4068 0x0 0
W 4 592.282447 5 0xef0000b0 0xf0294068 0x0 0
W 4 592.282452 5 0xef0000b0 0x6a180000 0x0 0
R 4 592.282463 5 0xef0000b0 0x3ccff47f 0x0 0
W 4 592.282468 5 0xef0000b0 0xea18f47f 0x0 0
W 4 592.282474 5 0xef0000b0 0x750e0000 0x0 0
R 4 592.282485 5 0xef0000b0 0x3ccf00f1 0x0 0
W 4 592.282490 5 0xef0000b0 0xf50e00f1 0x0 0
W 4 592.282495 5 0xef0000b0 0x75aa0000 0x0 0
R 4 592.282506 5 0xef0000b0 0x3ccf0000 0x0 0
W 4 592.282511 5 0xef0000b0 0xf5aa0001 0x0 0
W 4 592.282518 5 0xef0000b0 0x75aa0000 0x0 0
R 4 592.282528 5 0xef0000b0 0x3ccf0001 0x0 0
W 4 592.282533 5 0xef0000b0 0xf5aa0000 0x0 0
R 2 592.282545 5 0xef001880 0x2 0x0 0
W 2 592.282550 5 0xef001880 0x2 0x0 0
W 4 592.282555 5 0xef0000b0 0xf04cc302 0x0 0
W 4 592.282560 5 0xef0000b0 0x70070000 0x0 0
R 4 592.282573 5 0xef0000b0 0x1bc0 0x0 0
W 2 592.282578 5 0xef006048 0x60a 0x0 0
W 4 592.282583 5 0xef0000b0 0x70200000 0x0 0
R 4 592.282595 5 0xef0000b0 0x6f03 0x0 0
W 4 592.282600 5 0xef0000b0 0xf0206f03 0x0 0
R 4 592.282613 5 0xef0000f0 0x8003f 0x0 0
W 4 592.282618 5 0xef0000f0 0x3f 0x0 0
W 4 592.282623 5 0xef0000b0 0x60560000 0x0 0
R 4 592.282636 5 0xef0000b0 0x80002 0x0 0
W 4 592.282641 5 0xef0000b0 0xe0561f82 0x0 0
W 4 592.282647 5 0xef0000b0 0x70490000 0x0 0
R 4 592.282658 5 0xef0000b0 0x80800 0x0 0
W 4 592.282663 5 0xef0000b0 0xf0490800 0x0 0
R 1 592.282676 5 0xef000053 0x3c 0x0 0
W 1 592.282681 5 0xef000053 0x3c 0x0 0
R 1 592.282696 5 0xef000056 0x2 0x0 0
W 1 592.282701 5 0xef000056 0x2 0x0 0
W 2 592.282706 5 0xef0000da 0x4000 0x0 0
W 4 592.282711 5 0xef000024 0x0 0x0 0
W 4 592.282716 5 0xef000020 0xffbfb000 0x0 0
W 4 592.282721 5 0xef0000e8 0x0 0x0 0
W 4 592.282726 5 0xef0000e4 0xffbfa000 0x0 0
W 1 592.282731 5 0xef000050 0x0 0x0 0
W 1 592.282736 5 0xef000050 0xc0 0x0 0
W 1 592.282741 5 0xef000050 0x0 0x0 0
R 1 592.282781 5 0xef000037 0x0 0x0 0
W 1 592.282786 5 0xef000037 0xc 0x0 0
W 4 592.282791 5 0xef000044 0x40000f00 0x0 0
W 4 592.282796 5 0xef000040 0x3000700 0x0 0
R 4 592.282817 5 0xef000044 0x40020f00 0x0 0
W 4 592.282822 5 0xef000044 0x40c20f00 0x0 0
W 4 592.282828 5 0xef00000c 0x0 0x0 0
W 4 592.282833 5 0xef000008 0x40 0x0 0
R 4 592.282851 5 0xef000044 0x40c20f00 0x0 0
W 4 592.282857 5 0xef000044 0x40c20f0e 0x0 0
W 4 592.282862 5 0xef000038 0x3f 0x0 0
W 4 592.283477 5 0xef0000b8 0x52000000 0x0 0
R 4 592.283490 5 0xef0000b8 0xd2001040 0x0 0
R 4 592.283497 5 0xef0000b8 0xd2001040 0x0 0
W 4 592.305617 5 0xef000014 0x0 0x0 0
R 1 592.305641 5 0xef000037 0xc 0x0 0
W 4 592.305647 5 0xef000010 0xffffe000 0x0 0
W 4 592.305653 5 0xef000010 0xffffe001 0x0 0
R 4 592.305669 5 0xef000010 0xffffe000 0x0 0
W 4 592.305677 5 0xef00000c 0x0 0x0 0
W 4 592.305683 5 0xef000008 0x40 0x0 0
R 4 592.305699 5 0xef000044 0x40c20f0e 0x0 0
W 4 592.305705 5 0xef000044 0x40c20f0e 0x0 0
W 4 592.305890 5 0xef0000b8 0x52ea0000 0x0 0
R 4 592.305904 5 0xef0000b8 0xd2ea0081 0x0 0
R 4 592.305910 5 0xef0000b8 0xd2ea0081 0x0 0
W 4 592.305918 5 0xef0000b8 0x52e80000 0x0 0
R 4 592.305925 5 0xef0000b8 0xd2e80006 0x0 0
R 4 592.305932 5 0xef0000b8 0xd2e80006 0x0 0
W 4 592.305938 5 0xef0000b8 0x52040000 0x0 0
R 4 592.305945 5 0xef0000b8 0xd2041de1 0x0 0
R 4 592.305952 5 0xef0000b8 0xd2041de1 0x0 0
W 4 592.305958 5 0xef0000b8 0x52010000 0x0 0
R 4 592.305964 5 0xef0000b8 0xd2017989 0x0 0
R 4 592.305971 5 0xef0000b8 0xd2017989 0x0 0
W 4 592.305977 5 0xef0000b8 0x52090000 0x0 0
R 4 592.305984 5 0xef0000b8 0xd2090200 0x0 0
R 4 592.305991 5 0xef0000b8 0xd2090200 0x0 0
W 4 592.305997 5 0xef0000b8 0x52000000 0x0 0
R 4 592.306003 5 0xef0000b8 0xd2001040 0x0 0
R 4 592.306010 5 0xef0000b8 0xd2001040 0x0 0
W 4 592.306017 5 0xef0000b8 0x52eb0000 0x0 0
R 4 592.306023 5 0xef0000b8 0xd2eb0000 0x0 0
R 4 592.306030 5 0xef0000b8 0xd2eb0000 0x0 0
W 4 592.306037 5 0xef0000b8 0x52000000 0x0 0
R 4 592.306043 5 0xef0000b8 0xd2001040 0x0 0
R 4 592.306050 5 0xef0000b8 0xd2001040 0x0 0
W 4 592.306056 5 0xef0000b8 0x52010000 0x0 0
R 4 592.306063 5 0xef0000b8 0xd2017989 0x0 0
R 4 592.306069 5 0xef0000b8 0xd2017989 0x0 0
W 4 592.306075 5 0xef0000b8 0x52010000 0x0 0
R 4 592.306082 5 0xef0000b8 0xd2017989 0x0 0
R 4 592.306089 5 0xef0000b8 0xd2017989 0x0 0
W 4 592.306095 5 0xef0000b8 0x52090000 0x0 0
R 4 592.306102 5 0xef0000b8 0xd2090200 0x0 0
R 4 592.306108 5 0xef0000b8 0xd2090200 0x0 0
W 4 592.306114 5 0xef0000b8 0x520a0000 0x0 0
R 4 592.306121 5 0xef0000b8 0xd20a0000 0x0 0
R 4 592.306128 5 0xef0000b8 0xd20a0000 0x0 0
R 1 592.306380 5 0xef000037 0xc 0x0 0
W 4 592.306393 5 0xef000014 0x0 0x0 0
R 1 592.306408 5 0xef000037 0xc 0x0 0
W 4 592.306414 5 0xef000010 0xffffe000 0x0 0
W 4 592.306419 5 0xef000010 0xffffe008 0x0 0
R 4 592.306435 5 0xef000010 0xffffe000 0x0 0
W 4 592.307594 5 0xef00000c 0x80 0x0 0
W 4 592.307610 5 0xef000008 0x40 0x0 0
R 4 592.307625 5 0xef000044 0x40c20f0e 0x0 0
W 4 592.307630 5 0xef000044 0x40c20f0e 0x0 0
R 1 592.307713 5 0xef000037 0xc 0x0 0
W 4 592.307719 5 0xef000014 0x0 0x0 0
R 1 592.307734 5 0xef000037 0xc 0x0 0
W 4 592.307739 5 0xef000010 0xffffe000 0x0 0
W 4 592.307745 5 0xef000010 0xffffe008 0x0 0
R 4 592.307761 5 0xef000010 0xffffe000 0x0 0
W 4 592.308016 5 0xef000038 0x0 0x0 0
W 4 592.308030 5 0xef00003c 0xffffffff 0x0 0
R 1 592.308043 5 0xef000037 0xc 0x0 0
R 4 592.308056 5 0xef000044 0x40c20f0e 0x0 0
W 4 592.308061 5 0xef000044 0x40c20f00 0x0 0
R 4 592.308076 5 0xef0000f0 0x3f 0x0 0
W 4 592.308082 5 0xef0000f0 0x8003f 0x0 0
R 1 592.311416 5 0xef000037 0xc 0x0 0
W 1 592.311431 5 0xef000037 0x8c 0x0 0
R 1 592.311445 5 0xef0000d3 0x32 0x0 0
R 2 592.311458 5 0xef0000e2 0x103 0x0 0
W 1 592.315528 5 0xef000037 0x10 0x0 0
R 1 592.315555 5 0xef000037 0x0 0x0 0
W 1 592.315564 5 0xef000050 0xc0 0x0 0
W 4 592.315570 5 0xef0000b0 0x70490000 0x0 0
R 4 592.315582 5 0xef0000b0 0x800 0x0 0
W 4 592.315587 5 0xef0000b0 0xf0490800 0x0 0
R 1 592.315600 5 0xef000053 0x3c 0x0 0
W 1 592.315606 5 0xef000053 0x3c 0x0 0
R 1 592.315620 5 0xef000056 0x2 0x0 0
W 1 592.315625 5 0xef000056 0x2 0x0 0
W 2 592.315631 5 0xef0000e0 0x2020 0x0 0
W 4 592.315637 5 0xef000a00 0x0 0x0 0
W 4 592.315642 5 0xef000a04 0x0 0x0 0
W 4 592.315647 5 0xef000a08 0x0 0x0 0
W 4 592.315652 5 0xef000a0c 0x0 0x0 0
W 4 592.315659 5 0xef000a10 0x0 0x0 0
W 4 592.315664 5 0xef000a14 0x0 0x0 0
W 4 592.315669 5 0xef000a18 0x0 0x0 0
W 4 592.315675 5 0xef000a1c 0x0 0x0 0
W 4 592.315680 5 0xef000a20 0x0 0x0 0
W 4 592.315685 5 0xef000a24 0x0 0x0 0
W 4 592.315690 5 0xef000a28 0x0 0x0 0
W 4 592.315696 5 0xef000a2c 0x0 0x0 0
W 4 592.315701 5 0xef000a30 0x0 0x0 0
W 4 592.315706 5 0xef000a34 0x0 0x0 0
W 4 592.315711 5 0xef000a38 0x0 0x0 0
W 4 592.315717 5 0xef000a3c 0x0 0x0 0
W 4 592.315722 5 0xef000a40 0x0 0x0 0
W 4 592.315727 5 0xef000a44 0x0 0x0 0
W 4 592.315732 5 0xef000a48 0x0 0x0 0
W 4 592.315738 5 0xef000a4c 0x0 0x0 0
W 4 592.315743 5 0xef000a50 0x0 0x0 0
W 4 592.315748 5 0xef000a54 0x0 0x0 0
W 4 592.315753 5 0xef000a58 0x0 0x0 0
W 4 592.315759 5 0xef000a5c 0x0 0x0 0
W 4 592.315764 5 0xef000a60 0x0 0x0 0
W 4 592.315769 5 0xef000a64 0x0 0x0 0
W 4 592.315774 5 0xef000a68 0x0 0x0 0
W 4 592.315780 5 0xef000a6c 0x0 0x0 0
W 4 592.315785 5 0xef000a70 0x0 0x0 0
W 4 592.315790 5 0xef000a74 0x0 0x0 0
W 4 592.315796 5 0xef000a78 0x0 0x0 0
W 4 592.315801 5 0xef000a7c 0x0 0x0 0
W 4 592.315806 5 0xef000a80 0x0 0x0 0
W 4 592.315811 5 0xef000a84 0x0 0x0 0
W 4 592.315817 5 0xef000a88 0x0 0x0 0
W 4 592.315822 5 0xef000a8c 0x0 0x0 0
W 4 592.315827 5 0xef000a90 0x0 0x0 0
W 4 592.315832 5 0xef000a94 0x0 0x0 0
W 4 592.315838 5 0xef000a98 0x0 0x0 0
W 4 592.315843 5 0xef000a9c 0x0 0x0 0
W 4 592.315848 5 0xef000aa0 0x0 0x0 0
W 4 592.315853 5 0xef000aa4 0x0 0x0 0
W 4 592.315859 5 0xef000aa8 0x0 0x0 0
W 4 592.315864 5 0xef000aac 0x0 0x0 0
W 4 592.315869 5 0xef000ab0 0x0 0x0 0
W 4 592.315874 5 0xef000ab4 0x0 0x0 0
W 4 592.315880 5 0xef000ab8 0x0 0x0 0
W 4 592.315885 5 0xef000abc 0x0 0x0 0
W 4 592.315890 5 0xef000ac0 0x0 0x0 0
W 4 592.315895 5 0xef000ac4 0x0 0x0 0
W 4 592.315901 5 0xef000ac8 0x0 0x0 0
W 4 592.315906 5 0xef000acc 0x0 0x0 0
W 4 592.315911 5 0xef000ad0 0x0 0x0 0
W 4 592.315916 5 0xef000ad4 0x0 0x0 0
W 4 592.315922 5 0xef000ad8 0x0 0x0 0
W 4 592.315927 5 0xef000adc 0x0 0x0 0
W 4 592.315932 5 0xef000ae0 0x0 0x0 0
W 4 592.315937 5 0xef000ae4 0x0 0x0 0
W 4 592.315942 5 0xef000ae8 0x0 0x0 0
W 4 592.315948 5 0xef000aec 0x0 0x0 0
W 4 592.315953 5 0xef000af0 0x0 0x0 0
W 4 592.315958 5 0xef000af4 0x0 0x0 0
W 4 592.315963 5 0xef000af8 0x0 0x0 0
W 4 592.315969 5 0xef000afc 0x0 0x0 0
W 4 592.316031 5 0xef000080 0xb0000 0x0 0
R 4 592.316046 5 0xef000080 0x800ba908 0x0 0
R 4 592.316059 5 0xef000080 0x800ba908 0x0 0
W 4 592.316064 5 0xef000080 0x800ba908 0x0 0
R 4 592.316080 5 0xef000080 0xba908 0x0 0
W 4 592.316095 5 0xef000080 0x1e0000 0x0 0
R 4 592.316110 5 0xef000080 0x801e20eb 0x0 0
R 4 592.316123 5 0xef000080 0x801e20eb 0x0 0
W 4 592.316128 5 0xef000080 0x801e20eb 0x0 0
R 4 592.316144 5 0xef000080 0x1e20eb 0x0 0
W 4 592.316159 5 0xef000080 0xb0000 0x0 0
R 4 592.316174 5 0xef000080 0x800ba908 0x0 0
R 4 592.316187 5 0xef000080 0x800ba908 0x0 0
W 4 592.316192 5 0xef000080 0x800ba908 0x0 0
R 4 592.316208 5 0xef000080 0xba908 0x0 0
W 4 592.316223 5 0xef000080 0x1e0000 0x0 0
R 4 592.316238 5 0xef000080 0x801e20eb 0x0 0
R 4 592.316251 5 0xef000080 0x801e20eb 0x0 0
W 4 592.316256 5 0xef000080 0x801e20eb 0x0 0
R 4 592.316272 5 0xef000080 0x1e20eb 0x0 0
W 4 592.316287 5 0xef000080 0x20000 0x0 0
R 4 592.316302 5 0xef000080 0x800260e2 0x0 0
R 4 592.316315 5 0xef000080 0x800260e2 0x0 0
W 4 592.316320 5 0xef000080 0x800260e2 0x0 0
R 4 592.316335 5 0xef000080 0x260e2 0x0 0
W 4 592.316360 5 0xef000080 0x20000 0x0 0
R 4 592.316375 5 0xef000080 0x800260e2 0x0 0
R 4 592.316388 5 0xef000080 0x800260e2 0x0 0
W 4 592.316393 5 0xef000080 0x800260e2 0x0 0
R 4 592.316408 5 0xef000080 0x260e2 0x0 0
R 1 592.316430 5 0xef000054 0x60 0x0 0
W 1 592.316436 5 0xef000054 0x60 0x0 0
W 2 592.316441 5 0xef000382 0x221b 0x0 0
W 1 592.316447 5 0xef004500 0x0 0x0 0
W 2 592.316452 5 0xef004800 0x0 0x0 0
W 4 592.316458 5 0xef0000b0 0x6a050000 0x0 0
R 4 592.316472 5 0xef0000b0 0x1020088 0x0 0
W 4 592.316477 5 0xef0000b0 0xea050088 0x0 0
R 1 592.316490 5 0xef000052 0xcf 0x0 0
W 1 592.316495 5 0xef000052 0xcf 0x0 0
W 4 592.316501 5 0xef0000b0 0xe0a0ffff 0x0 0
W 4 592.316506 5 0xef0000b0 0xe0a1ffff 0x0 0
W 4 592.316511 5 0xef0000b0 0x69f10000 0x0 0
R 4 592.316524 5 0xef0000b0 0x3ccf03a9 0x0 0
W 4 592.316529 5 0xef0000b0 0xe9f103a9 0x0 0
W 4 592.316535 5 0xef0000b0 0x69f20000 0x0 0
R 4 592.316546 5 0xef0000b0 0x3ccf0000 0x0 0
W 4 592.316551 5 0xef0000b0 0xe9f20000 0x0 0
W 4 592.316556 5 0xef0000b0 0x74300000 0x0 0
R 4 592.316568 5 0xef0000b0 0x3ccf0080 0x0 0
W 4 592.316573 5 0xef0000b0 0xf4300080 0x0 0
W 4 592.316578 5 0xef0000b0 0x75ac0000 0x0 0
R 4 592.316589 5 0xef0000b0 0x3ccf0000 0x0 0
W 4 592.316595 5 0xef0000b0 0xf5ac0000 0x0 0
W 4 592.316600 5 0xef0000b0 0x730a0000 0x0 0
R 4 592.316611 5 0xef0000b0 0x3ccf02ff 0x0 0
W 4 592.316616 5 0xef0000b0 0xf30a02ff 0x0 0
W 4 592.316622 5 0xef0000b0 0x731f0000 0x0 0
R 4 592.316633 5 0xef0000b0 0x3ccf8000 0x0 0
W 4 592.316638 5 0xef0000b0 0xf31f8000 0x0 0
W 4 592.316643 5 0xef0000b0 0x605a0000 0x0 0
R 4 592.316655 5 0xef0000b0 0x3ccf002d 0x0 0
W 4 592.316660 5 0xef0000b0 0xe05a002d 0x0 0
W 4 592.316665 5 0xef0000b0 0x75b50000 0x0 0
R 4 592.316676 5 0xef0000b0 0x3ccf8033 0x0 0
W 4 592.316682 5 0xef0000b0 0xf5b58033 0x0 0
W 4 592.316687 5 0xef0000b0 0x75a80000 0x0 0
R 4 592.316698 5 0xef0000b0 0x3ccf0042 0x0 0
W 4 592.316703 5 0xef0000b0 0xf5a80042 0x0 0
W 4 592.316709 5 0xef0000b0 0x702b0000 0x0 0
R 4 592.316720 5 0xef0000b0 0x3ccf0030 0x0 0
W 4 592.316725 5 0xef0000b0 0xf02b0030 0x0 0
W 4 592.316730 5 0xef0000b0 0x70200000 0x0 0
R 4 592.316741 5 0xef0000b0 0x3ccf6f03 0x0 0
W 4 592.316747 5 0xef0000b0 0xf0206f03 0x0 0
W 4 592.316752 5 0xef0000b0 0x750e0000 0x0 0
R 4 592.316763 5 0xef0000b0 0x3ccf00f1 0x0 0
W 4 592.316768 5 0xef0000b0 0xf50e00f1 0x0 0
W 4 592.316774 5 0xef0000b0 0x70600000 0x0 0
R 4 592.316785 5 0xef0000b0 0x3ccf4403 0x0 0
W 4 592.316790 5 0xef0000b0 0xf0604403 0x0 0
W 4 592.316795 5 0xef0000b0 0x70290000 0x0 0
R 4 592.316807 5 0xef0000b0 0x3ccf4068 0x0 0
W 4 592.316812 5 0xef0000b0 0xf0294068 0x0 0
W 4 592.316817 5 0xef0000b0 0x6a180000 0x0 0
R 4 592.316828 5 0xef0000b0 0x3ccff47f 0x0 0
W 4 592.316834 5 0xef0000b0 0xea18f47f 0x0 0
W 4 592.316839 5 0xef0000b0 0x750e0000 0x0 0
R 4 592.316850 5 0xef0000b0 0x3ccf00f1 0x0 0
W 4 592.316855 5 0xef0000b0 0xf50e00f1 0x0 0
W 4 592.316861 5 0xef0000b0 0x75aa0000 0x0 0
R 4 592.316872 5 0xef0000b0 0x3ccf0000 0x0 0
W 4 592.316877 5 0xef0000b0 0xf5aa0001 0x0 0
W 4 592.316884 5 0xef0000b0 0x75aa0000 0x0 0
R 4 592.316894 5 0xef0000b0 0x3ccf0001 0x0 0
W 4 592.316899 5 0xef0000b0 0xf5aa0000 0x0 0
R 2 592.316911 5 0xef001880 0x1f82 0x0 0
W 2 592.316916 5 0xef001880 0x1f82 0x0 0
W 4 592.316921 5 0xef0000b0 0xf04cc302 0x0 0
W 4 592.316927 5 0xef0000b0 0x70070000 0x0 0
R 4 592.316939 5 0xef0000b0 0x1bc0 0x0 0
W 2 592.316944 5 0xef006048 0x60a 0x0 0
W 4 592.316949 5 0xef0000b0 0x70200000 0x0 0
R 4 592.316961 5 0xef0000b0 0x6f03 0x0 0
W 4 592.316967 5 0xef0000b0 0xf0206f03 0x0 0
R 4 592.316980 5 0xef0000f0 0x8003f 0x0 0
W 4 592.316985 5 0xef0000f0 0x3f 0x0 0
W 4 592.316990 5 0xef0000b0 0x60560000 0x0 0
R 4 592.317003 5 0xef0000b0 0x81f82 0x0 0
W 4 592.317008 5 0xef0000b0 0xe0561f82 0x0 0
W 4 592.317014 5 0xef0000b0 0x70490000 0x0 0
R 4 592.317025 5 0xef0000b0 0x80800 0x0 0
W 4 592.317030 5 0xef0000b0 0xf0490800 0x0 0
R 1 592.317043 5 0xef000053 0x3c 0x0 0
W 1 592.317048 5 0xef000053 0x3c 0x0 0
R 1 592.317063 5 0xef000056 0x2 0x0 0
W 1 592.317068 5 0xef000056 0x2 0x0 0
W 2 592.317073 5 0xef0000da 0x4000 0x0 0
W 4 592.317079 5 0xef000024 0x0 0x0 0
W 4 592.317084 5 0xef000020 0xffbfb000 0x0 0
W 4 592.317089 5 0xef0000e8 0x0 0x0 0
W 4 592.317094 5 0xef0000e4 0xffbfa000 0x0 0
W 1 592.317100 5 0xef000050 0x0 0x0 0
W 1 592.317105 5 0xef000050 0xc0 0x0 0
W 1 592.317110 5 0xef000050 0x0 0x0 0
R 1 592.317148 5 0xef000037 0x0 0x0 0
W 1 592.317154 5 0xef000037 0xc 0x0 0
W 4 592.317159 5 0xef000044 0x40000f00 0x0 0
W 4 592.317164 5 0xef000040 0x3000700 0x0 0
R 4 592.317186 5 0xef000044 0x40020f00 0x0 0
W 4 592.317191 5 0xef000044 0x40c20f00 0x0 0
W 4 592.317197 5 0xef00000c 0x80 0x0 0
W 4 592.317202 5 0xef000008 0x40 0x0 0
R 4 592.317220 5 0xef000044 0x40c20f00 0x0 0
W 4 592.317226 5 0xef000044 0x40c20f0e 0x0 0
W 4 592.317231 5 0xef000038 0x3f 0x0 0
R 1 592.317877 5 0xef000037 0xc 0x0 0
W 4 592.317890 5 0xef000014 0x0 0x0 0
R 1 592.317904 5 0xef000037 0xc 0x0 0
W 4 592.317909 5 0xef000010 0xffffe000 0x0 0
W 4 592.317914 5 0xef000010 0xffffe008 0x0 0
R 4 592.317931 5 0xef000010 0xffffe000 0x0 0
R 1 592.318593 5 0xef000037 0xc 0x0 0
W 4 592.318606 5 0xef000014 0x0 0x0 0
R 1 592.318621 5 0xef000037 0xc 0x0 0
W 4 592.318626 5 0xef000010 0xffffe000 0x0 0
W 4 592.318631 5 0xef000010 0xffffe008 0x0 0
R 4 592.318648 5 0xef000010 0xffffe000 0x0 0
R 1 603.047528 5 0xef000037 0xc 0x0 0
W 4 603.047552 5 0xef000014 0x0 0x0 0
R 1 603.047566 5 0xef000037 0xc 0x0 0
W 4 603.047572 5 0xef000010 0xffffe000 0x0 0
W 4 603.047578 5 0xef000010 0xffffe008 0x0 0
R 4 603.047594 5 0xef000010 0xffffe000 0x0 0
R 1 603.047633 5 0xef000037 0xc 0x0 0
W 4 603.047639 5 0xef000014 0x0 0x0 0
R 1 603.047654 5 0xef000037 0xc 0x0 0
W 4 603.047660 5 0xef000010 0xffffe000 0x0 0
W 4 603.047666 5 0xef000010 0xffffe008 0x0 0
R 4 603.047682 5 0xef000010 0xffffe000 0x0 0
